"yes","Other designer","2","arial, word, reality, Sure word, 1665","arial, word, thinking, Sure word, 1065","arial, non-word, drojects, Sure non-word, 2056","arial, non-word, considere, Probably non-word, 2512","arial, non-word, assinquent, Probably non-word, 2159","arial, word, probably, Sure word, 1496","arial, word, generally, Sure word, 1771","arial, word, guess, Sure word, 1022","arial, non-word, underation, Probably word, 2023","arial, non-word, blace, Probably non-word, 1967","arial, non-word, seanspother, Sure non-word, 1722","arial, non-word, potervation, Sure non-word, 1190","arial, non-word, sugoselves, Sure non-word, 1400","arial, word, garden, Sure word, 1458","arial, word, taught, Sure word, 854","arial, word, record, Sure word, 832","arial, word, north, Sure word, 833","arial, non-word, happose, Probably word, 2584","arial, non-word, headent, Probably non-word, 1943","arial, word, stage, Sure word, 1300","78","easy to read","sansforgetica, word, stage, seen, stage, Sure seen, 3508","sansforgetica, word, guilty, non-seen, guess, Probably not seen, 3435","sansforgetica, non-word, considere, seen, considere, Sure seen, 2944","sansforgetica, non-word, durprology, non-seen, drojects, Sure not seen, 1985","sansforgetica, word, problems, non-seen, probably, Sure seen, 2641","sansforgetica, non-word, underients, non-seen, underation, Probably not seen, 3207","sansforgetica, word, taught, seen, taught, Sure seen, 1409","sansforgetica, non-word, secent, non-seen, seanspother, Sure seen, 1630","sansforgetica, non-word, sugoselves, seen, sugoselves, Sure seen, 1338","sansforgetica, non-word, assinquent, seen, assinquent, Sure seen, 1238","sansforgetica, non-word, hartilment, non-seen, happose, Sure not seen, 1873","sansforgetica, word, reduced, non-seen, record, Probably not seen, 2311","sansforgetica, non-word, potervation, seen, potervation, Sure seen, 1722","sansforgetica, word, third, non-seen, thinking, Sure not seen, 2824","sansforgetica, word, garden, seen, garden, Sure seen, 1286","sansforgetica, word, generally, seen, generally, Probably seen, 1889","sansforgetica, non-word, leasumated, Probably non-word, 6384","sansforgetica, non-word, increved, Probably non-word, 3426","sansforgetica, word, hospital, Sure word, 1470","sansforgetica, non-word, lowely, Probably word, 4048","sansforgetica, non-word, forgotter, Probably non-word, 4057","sansforgetica, word, methods, Sure word, 1430","sansforgetica, word, educational, Sure word, 2224","sansforgetica, word, details, Sure word, 1052","sansforgetica, word, style, Sure word, 948","sansforgetica, word, meeting, Sure word, 955","sansforgetica, word, language, Sure word, 974","sansforgetica, non-word, consicular, Probably non-word, 3143","sansforgetica, non-word, easide, Probably non-word, 2368","sansforgetica, non-word, mingine, Probably non-word, 3530","sansforgetica, word, leading, Sure word, 1894","sansforgetica, non-word, presittes, Probably non-word, 3826","sansforgetica, non-word, childhons, Sure non-word, 2857","sansforgetica, word, trees, Sure word, 1425","sansforgetica, non-word, darrity, Probably non-word, 3716","sansforgetica, word, drive, Sure word, 1300","60","difficult to read","arial, non-word, presittes, seen, presittes, Sure seen, 2576","arial, non-word, eassed, non-seen, easide, Sure not seen, 2784","arial, word, driving, non-seen, drive, Sure seen, 1545","arial, word, hotel, non-seen, hospital, Probably seen, 2670","arial, word, educational, seen, educational, Sure seen, 1339","arial, non-word, leasumated, seen, leasumated, Sure seen, 1556","arial, word, large, non-seen, language, Probably not seen, 4233","arial, non-word, increved, seen, increved, Sure seen, 2121","arial, non-word, considance, non-seen, consicular, Probably seen, 2263","arial, non-word, forwared, non-seen, forgotter, Sure seen, 4306","arial, word, members, non-seen, meeting, Sure seen, 1479","arial, word, methods, seen, methods, Sure seen, 1265","arial, word, details, seen, details, Sure seen, 1767","arial, non-word, childity, non-seen, childhons, Probably not seen, 3945","arial, non-word, lowely, seen, lowely, Sure seen, 1574","arial, word, leading, seen, leading, Sure seen, 1896","2332271","13-04-2019 00:22"
"yes","Non-designer","2","arial, word, everyone, Sure word, 2586","arial, word, schools, Sure word, 2093","arial, non-word, numals, Probably word, 2783","arial, non-word, pigeboy, Probably non-word, 3066","arial, word, before, Sure word, 1976","arial, word, would, Sure word, 1993","arial, word, easier, Sure word, 2002","arial, non-word, congressary, Probably non-word, 3312","arial, non-word, apportuning, Probably non-word, 4709","arial, word, doubt, Sure word, 1935","arial, non-word, realicult, Sure non-word, 4055","arial, word, section, Sure word, 1980","arial, non-word, accephysive, Probably non-word, 4527","arial, word, papers, Sure word, 1975","arial, non-word, perind, Probably word, 2627","arial, non-word, mixting, Probably non-word, 3209","arial, non-word, assappead, Sure non-word, 2412","arial, word, current, Sure word, 2037","arial, non-word, mutomphers, Sure non-word, 4009","arial, word, nuclear, Sure word, 1837","76","very easy to read","sansforgetica, non-word, numals, seen, numals, Sure seen, 4143","sansforgetica, non-word, reaptality, non-seen, realicult, Probably not seen, 6326","sansforgetica, non-word, apportuning, seen, apportuning, Sure seen, 2615","sansforgetica, word, scientific, non-seen, schools, Sure not seen, 2885","sansforgetica, word, before, seen, before, Sure seen, 2392","sansforgetica, non-word, pillern, non-seen, pigeboy, Sure not seen, 2747","sansforgetica, non-word, mixting, seen, mixting, Sure seen, 2498","sansforgetica, non-word, accumplate, non-seen, accephysive, Sure not seen, 3840","sansforgetica, word, nuclear, seen, nuclear, Sure seen, 2296","sansforgetica, word, sector, non-seen, section, Sure not seen, 2569","sansforgetica, word, written, non-seen, would, Sure not seen, 2376","sansforgetica, word, dozen, non-seen, doubt, Sure not seen, 2113","sansforgetica, non-word, congressary, seen, congressary, Sure seen, 2323","sansforgetica, word, everyone, seen, everyone, Sure seen, 2245","sansforgetica, word, easier, seen, easier, Sure seen, 2077","sansforgetica, non-word, asserworly, non-seen, assappead, Sure not seen, 2795","sansforgetica, word, lunch, Sure word, 3400","sansforgetica, non-word, morking, Sure non-word, 3143","sansforgetica, word, miles, Sure word, 2532","sansforgetica, non-word, infantics, Probably non-word, 2675","sansforgetica, word, fairly, Sure word, 2063","sansforgetica, word, wrong, Sure word, 2006","sansforgetica, non-word, holts, Sure word, 2353","sansforgetica, non-word, affent, Sure non-word, 3682","sansforgetica, word, scale, Sure word, 2325","sansforgetica, non-word, feanspore, Probably non-word, 3524","sansforgetica, non-word, rivies, Sure non-word, 3060","sansforgetica, word, flowers, Sure word, 2061","sansforgetica, non-word, arrearature, Probably non-word, 7549","sansforgetica, non-word, definatute, Sure non-word, 3400","sansforgetica, word, community, Sure word, 2319","sansforgetica, word, smaller, Sure word, 1918","sansforgetica, word, calling, Sure word, 2026","sansforgetica, word, argument, Sure word, 2110","sansforgetica, non-word, brease, Sure non-word, 3765","sansforgetica, non-word, absturable, Probably non-word, 3013","81","very difficult to read","arial, word, faith, non-seen, fairly, Sure not seen, 3200","arial, word, community, seen, community, Sure seen, 2411","arial, non-word, affent, seen, affent, Sure seen, 2328","arial, word, lying, non-seen, lunch, Sure not seen, 2381","arial, word, argument, seen, argument, Sure seen, 2071","arial, non-word, infegatione, non-seen, infantics, Sure not seen, 2894","arial, non-word, morricit, non-seen, morking, Sure not seen, 2303","arial, non-word, brease, seen, brease, Sure seen, 2342","arial, word, smell, non-seen, smaller, Sure not seen, 2383","arial, word, scene, non-seen, scale, Sure not seen, 2116","arial, non-word, delident, non-seen, definatute, Probably not seen, 2998","arial, word, calling, seen, calling, Sure seen, 2192","arial, non-word, rivies, seen, rivies, Sure seen, 2346","arial, word, flowers, seen, flowers, Sure seen, 2095","arial, non-word, feelain, non-seen, feanspore, Sure not seen, 2505","arial, non-word, holts, seen, holts, Sure seen, 2153","2332259","13-04-2019 00:08"
"yes","Non-designer","2","sansforgetica, word, families, Sure word, 4208","sansforgetica, word, approach, Sure word, 1724","sansforgetica, non-word, discersion, Sure non-word, 4211","sansforgetica, word, performance, Sure word, 1655","sansforgetica, word, practical, Sure word, 1320","sansforgetica, non-word, irrection, Probably non-word, 4734","sansforgetica, non-word, authorantal, Sure non-word, 5989","sansforgetica, word, account, Sure word, 1707","sansforgetica, non-word, mothorate, Probably non-word, 6741","sansforgetica, non-word, somewing, Sure non-word, 3369","sansforgetica, word, daughter, Sure word, 1500","sansforgetica, non-word, sovies, Probably non-word, 2910","sansforgetica, non-word, childred, Probably non-word, 2485","sansforgetica, word, surface, Sure word, 1624","sansforgetica, word, above, Sure word, 1464","sansforgetica, word, special, Sure word, 1526","sansforgetica, word, powerful, Sure word, 1302","sansforgetica, non-word, decky, Probably non-word, 3409","sansforgetica, non-word, spectrition, Sure non-word, 3757","sansforgetica, non-word, fildle, Sure non-word, 2613","60","easy to read","arial, word, daughter, seen, daughter, Sure seen, 1893","arial, non-word, decommental, non-seen, decky, Sure not seen, 1894","arial, non-word, spectrition, seen, spectrition, Sure seen, 2099","arial, word, powerful, seen, powerful, Sure seen, 1698","arial, word, practical, seen, practical, Sure seen, 1198","arial, word, surprise, non-seen, surface, Probably not seen, 4554","arial, word, perhaps, non-seen, performance, Sure not seen, 1643","arial, word, absolutely, non-seen, above, Sure not seen, 1460","arial, non-word, sompenize, non-seen, somewing, Sure not seen, 1423","arial, non-word, irrection, seen, irrection, Sure seen, 1730","arial, word, approach, seen, approach, Sure seen, 1263","arial, non-word, authorantal, seen, authorantal, Sure seen, 1684","arial, non-word, mothorate, seen, mothorate, Sure seen, 1353","arial, non-word, finansive, non-seen, fildle, Sure not seen, 1629","arial, non-word, cittes, non-seen, childred, Sure not seen, 2655","arial, word, species, non-seen, special, Probably not seen, 2184","arial, word, named, Sure word, 4274","arial, non-word, derropround, Sure non-word, 3310","arial, non-word, serry, Probably non-word, 2189","arial, non-word, alreado, Probably non-word, 2311","arial, word, insurance, Sure word, 1510","arial, word, business, Sure word, 2347","arial, word, educational, Sure word, 1366","arial, word, still, Sure word, 1109","arial, non-word, partnestion, Probably non-word, 3018","arial, word, growth, Sure word, 1528","arial, word, smiled, Sure word, 1135","arial, word, especially, Sure word, 1221","arial, non-word, pericer, Probably non-word, 4801","arial, word, legal, Sure word, 1287","arial, word, leading, Sure word, 1117","arial, non-word, beight, Probably non-word, 3601","arial, non-word, considere, Sure non-word, 4524","arial, non-word, elinched, Probably non-word, 2222","arial, non-word, goliet, Probably non-word, 6252","arial, non-word, laucied, Probably non-word, 2508","55","easy to read","sansforgetica, non-word, derropround, seen, derropround, Sure not seen, 7664","sansforgetica, non-word, consiously, non-seen, considere, Sure not seen, 1826","sansforgetica, word, learn, non-seen, leading, Sure not seen, 2780","sansforgetica, non-word, empefic, non-seen, elinched, Sure not seen, 1438","sansforgetica, word, growth, seen, growth, Sure seen, 1613","sansforgetica, word, still, seen, still, Sure seen, 995","sansforgetica, word, intended, non-seen, insurance, Probably not seen, 3856","sansforgetica, word, smoke, non-seen, smiled, Sure not seen, 3547","sansforgetica, word, especially, seen, especially, Sure seen, 1411","sansforgetica, non-word, serry, seen, serry, Sure not seen, 4509","sansforgetica, non-word, alreado, seen, alreado, Sure seen, 2130","sansforgetica, word, educational, seen, educational, Sure seen, 1952","sansforgetica, non-word, beight, seen, beight, Sure seen, 1410","sansforgetica, non-word, leacted, non-seen, laucied, Probably not seen, 2893","sansforgetica, non-word, govelesses, non-seen, goliet, Sure not seen, 2133","sansforgetica, word, babies, non-seen, business, Sure not seen, 1509","2332241","12-04-2019 23:57"
"yes","Non-designer","2","sansforgetica, non-word, orindary, Sure word, 10657","sansforgetica, non-word, pertunaling, Probably non-word, 16490","sansforgetica, non-word, braded, Sure word, 6591","sansforgetica, word, accepted, Sure word, 1967","sansforgetica, non-word, roaked, Sure non-word, 11748","sansforgetica, non-word, noter, Probably non-word, 10266","sansforgetica, non-word, rementable, Probably non-word, 13902","sansforgetica, word, bring, Sure word, 3217","sansforgetica, word, independent, Sure word, 4442","sansforgetica, word, issue, Sure word, 2025","sansforgetica, word, least, Sure word, 2952","sansforgetica, word, already, Sure word, 2109","sansforgetica, non-word, plactarshed, Probably non-word, 14727","sansforgetica, non-word, increved, Sure non-word, 8989","sansforgetica, word, gently, Sure word, 2782","sansforgetica, word, talked, Sure word, 1696","sansforgetica, non-word, cloature, Sure non-word, 5872","sansforgetica, non-word, undonestes, Sure non-word, 4878","sansforgetica, word, provide, Sure word, 2452","sansforgetica, word, forgotten, Sure word, 3745","52","ok","arial, non-word, increved, seen, increved, Sure not seen, 7149","arial, word, accident, non-seen, accepted, Sure seen, 6265","arial, word, gently, seen, gently, Sure seen, 2108","arial, word, least, seen, least, Sure seen, 2785","arial, word, talked, seen, talked, Probably not seen, 4453","arial, non-word, braded, seen, braded, Sure seen, 2432","arial, non-word, pervice, non-seen, pertunaling, Probably seen, 6969","arial, non-word, cloature, seen, cloature, Sure seen, 3072","arial, word, individual, non-seen, independent, Sure not seen, 5040","arial, word, issue, seen, issue, Sure seen, 6400","arial, non-word, undouring, non-seen, undonestes, Probably not seen, 5817","arial, word, british, non-seen, bring, Sure not seen, 3590","arial, non-word, noter, seen, noter, Sure seen, 3445","arial, non-word, plandstions, non-seen, plactarshed, Sure not seen, 6007","arial, non-word, romoting, non-seen, roaked, Sure not seen, 3503","arial, word, public, non-seen, provide, Sure not seen, 2038","arial, word, throughout, Sure non-word, 8642","arial, word, awful, Sure word, 2540","arial, word, desire, Sure word, 1656","arial, word, attention, Sure word, 3285","arial, non-word, undertaned, Probably non-word, 6613","arial, word, telephone, Sure word, 2451","arial, word, putting, Sure word, 1847","arial, non-word, mixtured, Sure word, 5884","arial, word, scene, Probably non-word, 5321","arial, non-word, libermists, Sure non-word, 4003","arial, non-word, revernment, Sure word, 8276","arial, non-word, marmly, Sure non-word, 2894","arial, non-word, brives, Sure non-word, 5019","arial, non-word, dictrised, Sure non-word, 6073","arial, word, results, Sure word, 2103","arial, word, develop, Sure word, 1835","arial, non-word, steet, Sure word, 1536","arial, non-word, velerion, Sure non-word, 4021","arial, word, again, Sure word, 2986","arial, non-word, vegantable, Sure non-word, 9960","50","very easy to read","sansforgetica, word, television, non-seen, telephone, Sure seen, 5362","sansforgetica, non-word, broblem, non-seen, brives, Sure seen, 10476","sansforgetica, word, putting, seen, putting, Sure seen, 2033","sansforgetica, word, returned, non-seen, results, Sure seen, 1957","sansforgetica, word, attention, seen, attention, Sure seen, 1712","sansforgetica, non-word, steet, seen, steet, Sure seen, 2432","sansforgetica, non-word, martain, non-seen, marmly, Probably not seen, 4885","sansforgetica, word, against, non-seen, again, Sure seen, 2229","sansforgetica, non-word, vegantable, seen, vegantable, Sure seen, 2759","sansforgetica, word, throughout, seen, throughout, Sure seen, 1927","sansforgetica, non-word, revernment, seen, revernment, Sure seen, 1886","sansforgetica, non-word, venerweared, non-seen, velerion, Probably not seen, 3039","sansforgetica, non-word, undevollity, non-seen, undertaned, Sure seen, 4152","sansforgetica, word, scheme, non-seen, scene, Sure seen, 1898","sansforgetica, non-word, mixtured, seen, mixtured, Sure seen, 1655","sansforgetica, word, desire, seen, desire, Sure seen, 1664","2332226","12-04-2019 23:45"
"yes","Graphic designer","2","sansforgetica, word, early, Sure word, 5046","sansforgetica, word, supposed, Sure word, 2203","sansforgetica, word, higher, Sure word, 1549","sansforgetica, word, expensive, Sure word, 1524","sansforgetica, non-word, moventive, Probably non-word, 3463","sansforgetica, word, economy, Sure word, 2016","sansforgetica, non-word, brease, Sure non-word, 3136","sansforgetica, word, steps, Sure word, 2306","sansforgetica, word, introduced, Sure word, 2512","sansforgetica, word, minute, Sure word, 1143","sansforgetica, non-word, momorned, Sure non-word, 7033","sansforgetica, non-word, dearn, Probably non-word, 5951","sansforgetica, non-word, frafering, Sure non-word, 5581","sansforgetica, non-word, speerement, Sure non-word, 4183","sansforgetica, non-word, altional, Sure non-word, 3963","sansforgetica, non-word, requinest, Sure non-word, 2613","sansforgetica, word, conference, Sure word, 2046","sansforgetica, non-word, refectuning, Probably word, 7016","sansforgetica, word, through, Sure word, 2884","sansforgetica, non-word, contem, Probably non-word, 4385","45","difficult to read","arial, non-word, frafering, seen, frafering, Sure not seen, 8996","arial, non-word, refectuning, seen, refectuning, Sure seen, 5008","arial, non-word, contem, seen, contem, Sure seen, 1489","arial, non-word, monded, non-seen, momorned, Probably not seen, 4255","arial, word, higher, seen, higher, Sure seen, 1965","arial, non-word, moventive, seen, moventive, Sure seen, 1599","arial, word, model, non-seen, minute, Sure not seen, 2202","arial, non-word, brevided, non-seen, brease, Sure not seen, 2184","arial, word, steps, seen, steps, Sure seen, 1896","arial, word, confidence, non-seen, conference, Probably seen, 2625","arial, word, surely, non-seen, supposed, Sure not seen, 3068","arial, word, introduced, seen, introduced, Sure seen, 2007","arial, word, earth, non-seen, early, Sure not seen, 2970","arial, non-word, altonition, non-seen, altional, Sure seen, 2648","arial, non-word, splectore, non-seen, speerement, Sure not seen, 2888","arial, word, expensive, seen, expensive, Sure not seen, 3233","arial, non-word, preaped, Probably non-word, 6834","arial, non-word, seanspother, Sure non-word, 6174","arial, word, glasses, Sure word, 2707","arial, word, central, Sure word, 1760","arial, non-word, guatiammer, Probably non-word, 5251","arial, word, turned, Sure word, 2006","arial, non-word, eather, Probably non-word, 5073","arial, word, relatively, Sure word, 1953","arial, non-word, viried, Sure non-word, 3362","arial, non-word, definatute, Sure non-word, 5024","arial, non-word, centent, Probably word, 3002","arial, non-word, grened, Probably non-word, 3347","arial, non-word, feelain, Sure non-word, 2607","arial, word, success, Sure word, 2001","arial, word, memory, Sure word, 982","arial, word, doubt, Sure word, 911","arial, word, nearly, Sure word, 943","arial, word, after, Sure word, 904","arial, word, respect, Sure word, 977","arial, non-word, chares, Probably non-word, 3972","61","very easy to read","sansforgetica, word, memory, seen, memory, Probably seen, 5532","sansforgetica, non-word, secent, non-seen, seanspother, Probably not seen, 3418","sansforgetica, non-word, viried, seen, viried, Probably not seen, 4271","sansforgetica, non-word, centoment, non-seen, centent, Probably not seen, 3568","sansforgetica, word, centre, non-seen, central, Sure not seen, 3219","sansforgetica, word, nearly, seen, nearly, Sure seen, 2134","sansforgetica, word, turning, non-seen, turned, Probably not seen, 4279","sansforgetica, non-word, delident, non-seen, definatute, Sure not seen, 4145","sansforgetica, word, relief, non-seen, relatively, Sure not seen, 1441","sansforgetica, non-word, feelain, seen, feelain, Sure seen, 2648","sansforgetica, non-word, grened, seen, grened, Sure seen, 1527","sansforgetica, non-word, preaped, seen, preaped, Sure seen, 1794","sansforgetica, word, doubt, seen, doubt, Sure seen, 1351","sansforgetica, word, afternoon, non-seen, after, Sure not seen, 2928","sansforgetica, word, success, seen, success, Probably not seen, 3025","sansforgetica, non-word, edgins, non-seen, eather, Sure not seen, 2856","2332216","12-04-2019 23:35"
"yes","Non-designer","2","arial, word, fight, Sure word, 1640","arial, word, trust, Sure word, 1395","arial, non-word, assumerater, Probably word, 2697","arial, non-word, hartilment, Sure word, 3022","arial, word, happening, Sure word, 1556","arial, non-word, structious, Sure word, 2086","arial, word, church, Sure word, 1456","arial, non-word, dissehons, Probably word, 1941","arial, non-word, dindow, Probably word, 2205","arial, non-word, infegatione, Probably non-word, 4395","arial, word, courses, Sure word, 1532","arial, word, older, Sure word, 1404","arial, non-word, confusses, Sure non-word, 4247","arial, non-word, gromish, Probably non-word, 2365","arial, word, changing, Sure word, 1842","arial, non-word, fambolio, Sure non-word, 3300","arial, word, classes, Sure word, 1573","arial, word, revolution, Sure word, 1485","arial, word, world, Sure word, 1445","arial, non-word, alteriously, Sure word, 1989","50","ok","sansforgetica, non-word, hartilment, seen, hartilment, Sure seen, 5031","sansforgetica, non-word, strugess, non-seen, structious, Sure seen, 2804","sansforgetica, word, worry, non-seen, world, Sure not seen, 2851","sansforgetica, word, trust, seen, trust, Sure seen, 1979","sansforgetica, non-word, fament, non-seen, fambolio, Probably not seen, 3848","sansforgetica, word, church, seen, church, Sure seen, 1595","sansforgetica, non-word, infortition, non-seen, infegatione, Probably not seen, 3463","sansforgetica, non-word, confusses, seen, confusses, Sure seen, 2356","sansforgetica, word, fight, seen, fight, Sure seen, 2047","sansforgetica, word, clean, non-seen, classes, Sure not seen, 2024","sansforgetica, word, court, non-seen, courses, Sure not seen, 2205","sansforgetica, non-word, guarpapers, non-seen, gromish, Sure not seen, 2174","sansforgetica, word, opened, non-seen, older, Sure not seen, 1968","sansforgetica, word, changing, seen, changing, Probably seen, 5183","sansforgetica, non-word, dissehons, seen, dissehons, Sure seen, 1888","sansforgetica, non-word, assumerater, seen, assumerater, Sure seen, 1909","sansforgetica, word, winter, Sure word, 2358","sansforgetica, non-word, intersift, Probably non-word, 2321","sansforgetica, word, promised, Sure word, 1339","sansforgetica, non-word, againes, Probably non-word, 3756","sansforgetica, non-word, systed, Probably non-word, 3061","sansforgetica, non-word, prowney, Probably non-word, 1677","sansforgetica, word, three, Sure word, 1427","sansforgetica, word, political, Sure word, 1463","sansforgetica, word, operations, Sure word, 1705","sansforgetica, non-word, varearing, Probably non-word, 4367","sansforgetica, word, finding, Sure word, 1478","sansforgetica, word, round, Sure word, 1375","sansforgetica, non-word, althdren, Probably non-word, 3260","sansforgetica, non-word, verving, Probably word, 5375","sansforgetica, word, announced, Sure word, 1454","sansforgetica, non-word, feanspore, Sure non-word, 2188","sansforgetica, word, schools, Sure word, 2173","sansforgetica, non-word, fraditted, Sure non-word, 2048","sansforgetica, word, peace, Sure word, 1467","sansforgetica, non-word, natume, Sure word, 1591","50","very difficult to read","arial, word, scientific, non-seen, schools, Probably not seen, 4363","arial, non-word, punner, non-seen, prowney, Probably not seen, 2081","arial, non-word, althdren, seen, althdren, Sure seen, 3029","arial, word, politics, non-seen, political, Sure seen, 1479","arial, word, round, seen, round, Sure seen, 1854","arial, non-word, verving, seen, verving, Sure seen, 1499","arial, word, finding, seen, finding, Sure seen, 1364","arial, non-word, syster, non-seen, systed, Sure seen, 1927","arial, word, announced, seen, announced, Sure seen, 1756","arial, word, wished, non-seen, winter, Sure not seen, 3242","arial, non-word, natume, seen, natume, Sure seen, 1702","arial, non-word, frafering, non-seen, fraditted, Probably seen, 4407","arial, non-word, aggreciled, non-seen, againes, Probably seen, 4933","arial, word, promised, seen, promised, Sure seen, 2918","arial, non-word, feanspore, seen, feanspore, Sure seen, 1894","arial, word, opinion, non-seen, operations, Sure seen, 1786","2332210","12-04-2019 23:28"
