"Fluent","Designer","studyid","test_1_lexical_1","test_1_lexical_2","test_1_lexical_3","test_1_lexical_4","test_1_lexical_5","test_1_lexical_6","test_1_lexical_7","test_1_lexical_8","test_1_lexical_9","test_1_lexical_10","test_1_lexical_11","test_1_lexical_12","test_1_lexical_13","test_1_lexical_14","test_1_lexical_15","test_1_lexical_16","test_1_lexical_17","test_1_lexical_18","test_1_lexical_19","test_1_lexical_20","test_1_remember","test_1_legibility","test_1_recognition_1","test_1_recognition_2","test_1_recognition_3","test_1_recognition_4","test_1_recognition_5","test_1_recognition_6","test_1_recognition_7","test_1_recognition_8","test_1_recognition_9","test_1_recognition_10","test_1_recognition_11","test_1_recognition_12","test_1_recognition_13","test_1_recognition_14","test_1_recognition_15","test_1_recognition_16","test_2_lexical_1","test_2_lexical_2","test_2_lexical_3","test_2_lexical_4","test_2_lexical_5","test_2_lexical_6","test_2_lexical_7","test_2_lexical_8","test_2_lexical_9","test_2_lexical_10","test_2_lexical_11","test_2_lexical_12","test_2_lexical_13","test_2_lexical_14","test_2_lexical_15","test_2_lexical_16","test_2_lexical_17","test_2_lexical_18","test_2_lexical_19","test_2_lexical_20","test_2_remember","test_2_legibility","test_2_recognition_1","test_2_recognition_2","test_2_recognition_3","test_2_recognition_4","test_2_recognition_5","test_2_recognition_6","test_2_recognition_7","test_2_recognition_8","test_2_recognition_9","test_2_recognition_10","test_2_recognition_11","test_2_recognition_12","test_2_recognition_13","test_2_recognition_14","test_2_recognition_15","test_2_recognition_16","",""
"yes","Graphic designer","2","sansforgetica, word, finished, Sure word, 3215","sansforgetica, non-word, discritunds, Probably word, 3037","sansforgetica, word, worst, Sure word, 2609","sansforgetica, non-word, expermists, Sure non-word, 3203","sansforgetica, word, happening, Sure word, 3256","sansforgetica, non-word, gendish, Probably non-word, 1872","sansforgetica, non-word, smalish, Sure non-word, 2022","sansforgetica, non-word, rectined, Sure non-word, 1871","sansforgetica, word, offered, Sure word, 2118","sansforgetica, non-word, eleculants, Probably non-word, 3003","sansforgetica, word, longer, Sure word, 3013","sansforgetica, word, regular, Sure word, 1576","sansforgetica, word, changing, Sure word, 1105","sansforgetica, non-word, milently, Sure non-word, 3420","sansforgetica, non-word, capossed, Sure non-word, 2424","sansforgetica, word, shape, Sure word, 1737","sansforgetica, non-word, althdren, Sure non-word, 1841","sansforgetica, non-word, studymer, Sure non-word, 1948","sansforgetica, word, capital, Sure word, 1808","sansforgetica, word, merely, Sure word, 1955","15","difficult to read","arial, non-word, capossed, seen, capossed, Probably seen, 6138","arial, non-word, disculates, non-seen, discritunds, Probably seen, 1987","arial, non-word, expermists, seen, expermists, Sure seen, 2642","arial, non-word, rectined, seen, rectined, Sure seen, 1808","arial, word, shape, seen, shape, Sure seen, 1317","arial, non-word, smild, non-seen, smalish, Probably not seen, 2423","arial, non-word, eleculants, seen, eleculants, Sure not seen, 2269","arial, word, office, non-seen, offered, Probably seen, 2028","arial, word, worst, seen, worst, Sure seen, 1801","arial, word, merely, seen, merely, Sure seen, 2714","arial, word, happening, seen, happening, Sure seen, 985","arial, word, first, non-seen, finished, Sure not seen, 2537","arial, non-word, generients, non-seen, gendish, Probably not seen, 1962","arial, word, relations, non-seen, regular, Probably not seen, 2382","arial, word, chapter, non-seen, changing, Probably not seen, 1438","arial, non-word, milevate, non-seen, milently, Probably seen, 1736","arial, word, involved, Sure word, 2481","arial, word, battle, Sure word, 839","arial, non-word, punner, Probably word, 1817","arial, non-word, alteriously, Probably non-word, 2496","arial, word, bottom, Sure word, 1553","arial, non-word, butlized, Probably non-word, 1710","arial, non-word, fenis, Probably non-word, 2868","arial, non-word, bodder, Probably word, 2513","arial, word, choice, Sure word, 2826","arial, word, calling, Sure word, 1082","arial, non-word, flueement, Sure non-word, 1971","arial, word, expression, Sure word, 2326","arial, non-word, umbrated, Probably non-word, 3109","arial, non-word, fineraing, Sure non-word, 2293","arial, word, population, Sure word, 1487","arial, word, instance, Sure word, 1429","arial, word, effective, Sure word, 994","arial, non-word, sountion, Sure non-word, 1761","arial, word, medical, Sure word, 2459","arial, non-word, intervating, Probably non-word, 2302","23","very easy to read","sansforgetica, word, meeting, non-seen, medical, Probably seen, 6485","sansforgetica, word, choice, seen, choice, Sure seen, 1301","sansforgetica, word, involved, seen, involved, Sure seen, 2139","sansforgetica, non-word, fenis, seen, fenis, Sure seen, 1285","sansforgetica, non-word, foilly, non-seen, flueement, Probably not seen, 3015","sansforgetica, non-word, alrence, non-seen, alteriously, Sure not seen, 2106","sansforgetica, word, bottom, seen, bottom, Sure seen, 1543","sansforgetica, word, population, seen, population, Sure seen, 1042","sansforgetica, word, instead, non-seen, instance, Probably not seen, 2092","sansforgetica, non-word, bodder, seen, bodder, Sure seen, 1639","sansforgetica, non-word, intervating, seen, intervating, Probably not seen, 3683","sansforgetica, non-word, umbrated, seen, umbrated, Sure seen, 2561","sansforgetica, non-word, sovess, non-seen, sountion, Probably not seen, 1736","sansforgetica, non-word, backling, non-seen, butlized, Sure not seen, 2985","sansforgetica, word, beach, non-seen, battle, Sure seen, 4240","sansforgetica, word, extent, non-seen, expression, Probably not seen, 2786","2487026","25-04-2019 13:47"
"yes","Graphic designer","2","sansforgetica, word, begins, Sure word, 4040","sansforgetica, non-word, demillining, Probably non-word, 7334","sansforgetica, word, scheme, Sure word, 2026","sansforgetica, non-word, finth, Sure non-word, 5838","sansforgetica, word, alone, Sure word, 1227","sansforgetica, non-word, pollowism, Probably non-word, 4892","sansforgetica, non-word, fathed, Probably word, 6245","sansforgetica, non-word, numals, Probably word, 4357","sansforgetica, word, daily, Sure word, 1301","sansforgetica, word, brown, Sure word, 1024","sansforgetica, word, prevent, Sure word, 3578","sansforgetica, non-word, insumn, Probably word, 3186","sansforgetica, non-word, examitional, Sure non-word, 4677","sansforgetica, non-word, preakfase, Sure non-word, 2892","sansforgetica, word, centre, Sure word, 1372","sansforgetica, word, experience, Sure word, 1285","sansforgetica, non-word, backling, Probably non-word, 2956","sansforgetica, non-word, legan, Sure non-word, 4062","sansforgetica, word, teeth, Sure word, 1462","sansforgetica, word, socialist, Sure word, 1306","75","ok","arial, word, explained, non-seen, experience, Probably not seen, 6471","arial, non-word, examped, non-seen, examitional, Sure not seen, 1953","arial, word, brown, seen, brown, Sure seen, 1541","arial, non-word, denerstion, non-seen, demillining, Sure not seen, 1745","arial, non-word, preakfase, seen, preakfase, Sure seen, 1777","arial, word, damage, non-seen, daily, Probably not seen, 2442","arial, non-word, fissely, non-seen, finth, Probably seen, 2822","arial, word, socialist, seen, socialist, Sure seen, 1263","arial, word, telephone, non-seen, teeth, Sure not seen, 2327","arial, word, alone, seen, alone, Sure seen, 1540","arial, word, school, non-seen, scheme, Probably seen, 2161","arial, non-word, pollowism, seen, pollowism, Sure seen, 1395","arial, non-word, insumn, seen, insumn, Sure seen, 2149","arial, word, prevent, seen, prevent, Sure seen, 2430","arial, non-word, numals, seen, numals, Sure seen, 1123","arial, non-word, legetation, non-seen, legan, Probably not seen, 3826","arial, word, heads, Sure word, 3624","arial, non-word, systed, Probably non-word, 2576","arial, word, hands, Sure word, 1080","arial, non-word, velerion, Probably word, 3583","arial, word, putting, Sure word, 2425","arial, non-word, starned, Probably word, 2699","arial, word, somebody, Sure word, 1170","arial, word, fingers, Sure word, 923","arial, non-word, arrinst, Probably non-word, 2599","arial, non-word, goliet, Sure non-word, 3533","arial, non-word, itaters, Sure non-word, 1619","arial, word, minister, Sure word, 1159","arial, non-word, farkeyary, Sure non-word, 7035","arial, non-word, remernal, Probably word, 2190","arial, word, department, Sure word, 1248","arial, word, teaching, Sure word, 1350","arial, non-word, popubligals, Sure non-word, 2423","arial, word, trees, Sure word, 1571","arial, non-word, olded, Probably word, 9465","arial, word, everything, Sure word, 1065","40","very easy to read","sansforgetica, word, somehow, non-seen, somebody, Probably seen, 6832","sansforgetica, non-word, remernal, seen, remernal, Probably not seen, 3888","sansforgetica, non-word, arror, non-seen, arrinst, Sure not seen, 2183","sansforgetica, word, finished, non-seen, fingers, Sure seen, 1372","sansforgetica, word, hands, seen, hands, Sure seen, 983","sansforgetica, non-word, steet, non-seen, starned, Sure not seen, 1538","sansforgetica, non-word, govelesses, non-seen, goliet, Sure not seen, 1597","sansforgetica, word, evidence, non-seen, everything, Probably seen, 1844","sansforgetica, non-word, possecapped, non-seen, popubligals, Probably not seen, 1980","sansforgetica, word, department, seen, department, Sure seen, 1328","sansforgetica, word, putting, seen, putting, Sure seen, 2115","sansforgetica, non-word, olded, seen, olded, Sure seen, 1193","sansforgetica, word, minute, non-seen, minister, Sure not seen, 1803","sansforgetica, non-word, itaters, seen, itaters, Probably seen, 3247","sansforgetica, non-word, systed, seen, systed, Probably seen, 8595","sansforgetica, word, trees, seen, trees, Sure seen, 1205","2486953","25-04-2019 13:42"
"yes","Graphic designer","2","sansforgetica, non-word, lecieve, Probably non-word, 8600","sansforgetica, word, planning, Sure word, 2099","sansforgetica, non-word, gallowned, Probably non-word, 4960","sansforgetica, word, exactly, Sure word, 1592","sansforgetica, non-word, rivil, Sure non-word, 3250","sansforgetica, non-word, tramines, Sure non-word, 3053","sansforgetica, word, relations, Sure word, 1917","sansforgetica, word, nuclear, Sure word, 1377","sansforgetica, non-word, underation, Probably word, 3810","sansforgetica, non-word, teliquely, Sure non-word, 3564","sansforgetica, word, their, Sure word, 1858","sansforgetica, non-word, grattered, Probably non-word, 2534","sansforgetica, word, sitting, Sure word, 2470","sansforgetica, word, basic, Sure word, 1050","sansforgetica, non-word, unconscents, Probably non-word, 3407","sansforgetica, non-word, docionating, Sure non-word, 2057","sansforgetica, word, perfect, Sure word, 1498","sansforgetica, non-word, rechnolles, Sure non-word, 2050","sansforgetica, word, replied, Sure word, 1663","sansforgetica, word, manner, Sure word, 1091","50","easy to read","arial, non-word, gallowned, seen, gallowned, Sure seen, 2135","arial, non-word, legan, non-seen, lecieve, Sure not seen, 2184","arial, non-word, unconscents, seen, unconscents, Sure seen, 2029","arial, word, reported, non-seen, replied, Probably not seen, 3210","arial, word, perfect, seen, perfect, Sure seen, 1697","arial, word, nuclear, seen, nuclear, Sure seen, 988","arial, non-word, roaked, non-seen, rivil, Sure not seen, 2110","arial, non-word, docionating, seen, docionating, Sure seen, 1830","arial, word, basic, seen, basic, Sure seen, 940","arial, word, planning, seen, planning, Sure seen, 807","arial, word, example, non-seen, exactly, Sure not seen, 2285","arial, non-word, underients, non-seen, underation, Sure not seen, 1982","arial, word, relatively, non-seen, relations, Probably seen, 2876","arial, word, themselves, non-seen, their, Sure not seen, 1941","arial, non-word, teliquely, seen, teliquely, Sure seen, 2186","arial, non-word, grawn, non-seen, grattered, Probably not seen, 2149","arial, non-word, nortinge, Sure non-word, 6206","arial, word, offered, Sure word, 1564","arial, word, labour, Sure word, 1173","arial, non-word, explanented, Probably non-word, 2039","arial, word, remain, Sure word, 1377","arial, word, health, Sure word, 880","arial, non-word, alreado, Sure non-word, 1818","arial, word, political, Sure word, 1557","arial, word, might, Sure word, 913","arial, non-word, deterienth, Sure non-word, 2341","arial, non-word, strugess, Sure non-word, 1417","arial, word, nodded, Sure word, 1638","arial, non-word, papsy, Sure non-word, 1995","arial, word, agreement, Sure word, 1445","arial, non-word, simeweres, Sure non-word, 1744","arial, non-word, griends, Sure non-word, 2323","arial, word, listen, Sure word, 1307","arial, non-word, parmined, Sure non-word, 2582","arial, word, lines, Sure word, 1736","arial, non-word, sollaren, Probably non-word, 2160","70","very easy to read","sansforgetica, non-word, papsy, seen, papsy, Sure seen, 2631","sansforgetica, word, political, seen, political, Sure seen, 1183","sansforgetica, non-word, grocks, non-seen, griends, Sure not seen, 2160","sansforgetica, non-word, studity, non-seen, strugess, Sure not seen, 1532","sansforgetica, word, noise, non-seen, nodded, Sure not seen, 1353","sansforgetica, word, lines, seen, lines, Sure seen, 1572","sansforgetica, non-word, deterienth, seen, deterienth, Sure seen, 2315","sansforgetica, non-word, noter, non-seen, nortinge, Sure not seen, 2230","sansforgetica, non-word, partnestion, non-seen, parmined, Probably not seen, 2466","sansforgetica, non-word, alreado, seen, alreado, Sure seen, 2308","sansforgetica, word, remain, seen, remain, Probably seen, 3251","sansforgetica, non-word, explanented, seen, explanented, Sure seen, 2251","sansforgetica, word, listening, non-seen, listen, Sure not seen, 2468","sansforgetica, word, labour, seen, labour, Sure seen, 1508","sansforgetica, word, ahead, non-seen, agreement, Sure not seen, 2283","sansforgetica, word, miles, non-seen, might, Sure not seen, 1346","2486080","25-04-2019 12:45"
"yes","Graphic designer","2","sansforgetica, non-word, ancidly, Probably word, 4728","sansforgetica, word, ground, Sure word, 1759","sansforgetica, non-word, venerweared, Probably non-word, 3678","sansforgetica, word, nobody, Sure word, 1638","sansforgetica, non-word, lowely, Sure word, 1870","sansforgetica, non-word, impeady, Probably non-word, 3129","sansforgetica, word, several, Sure word, 1492","sansforgetica, non-word, ultomobile, Probably non-word, 2033","sansforgetica, non-word, macrector, Probably non-word, 3655","sansforgetica, word, perhaps, Sure word, 1467","sansforgetica, word, ordered, Sure word, 1354","sansforgetica, word, merely, Sure word, 1408","sansforgetica, word, north, Sure word, 2791","sansforgetica, word, someone, Sure word, 1226","sansforgetica, non-word, increved, Probably word, 4519","sansforgetica, non-word, peoped, Sure non-word, 1950","sansforgetica, non-word, softwall, Sure word, 1543","sansforgetica, word, travel, Sure word, 1420","sansforgetica, non-word, hunneshed, Probably non-word, 2063","sansforgetica, word, personal, Sure word, 1167","50","easy to read","arial, word, someone, seen, someone, Sure seen, 3030","arial, word, merely, seen, merely, Sure seen, 1393","arial, non-word, peoply, non-seen, peoped, Sure seen, 4421","arial, word, treated, non-seen, travel, Probably not seen, 3597","arial, word, personal, seen, personal, Sure seen, 1646","arial, non-word, impeady, seen, impeady, Sure seen, 3348","arial, non-word, sollaren, non-seen, softwall, Sure seen, 688","arial, non-word, ultomobile, seen, ultomobile, Sure seen, 1388","arial, non-word, lowely, seen, lowely, Sure seen, 1332","arial, non-word, magnivately, non-seen, macrector, Probably not seen, 2306","arial, non-word, verection, non-seen, venerweared, Probably not seen, 2324","arial, non-word, increved, seen, increved, Probably not seen, 2641","arial, word, groups, non-seen, ground, Sure not seen, 2032","arial, word, nodded, non-seen, nobody, Sure not seen, 1552","arial, word, perhaps, seen, perhaps, Sure seen, 1411","arial, word, ordinary, non-seen, ordered, Probably not seen, 2040","arial, word, attitude, Sure word, 2209","arial, non-word, tounning, Probably non-word, 1930","arial, non-word, brives, Probably non-word, 1798","arial, non-word, nommidated, Probably non-word, 1980","arial, non-word, disculates, Probably word, 1973","arial, word, slowly, Sure word, 1260","arial, non-word, dearn, Probably word, 1440","arial, non-word, ralls, Probably non-word, 1707","arial, non-word, holts, Sure word, 1648","arial, word, thousands, Sure word, 1228","arial, word, often, Sure word, 1229","arial, non-word, engistriate, Probably word, 2114","arial, word, security, Sure word, 1296","arial, word, drawn, Sure word, 1704","arial, non-word, sligince, Sure non-word, 1770","arial, word, trouble, Sure word, 1514","arial, word, running, Sure word, 1273","arial, word, special, Sure word, 1262","arial, word, facts, Sure word, 1298","arial, non-word, indernment, Probably non-word, 1779","50","very easy to read","sansforgetica, non-word, ralls, seen, ralls, Sure seen, 5075","sansforgetica, word, trouble, seen, trouble, Sure seen, 1794","sansforgetica, non-word, enorming, non-seen, engistriate, Probably not seen, 2720","sansforgetica, word, older, non-seen, often, Sure not seen, 1849","sansforgetica, word, facts, seen, facts, Sure seen, 1301","sansforgetica, non-word, dechnology, non-seen, dearn, Sure not seen, 1907","sansforgetica, non-word, towever, non-seen, tounning, Probably not seen, 2424","sansforgetica, non-word, indernment, seen, indernment, Probably not seen, 2305","sansforgetica, word, special, seen, special, Sure seen, 1440","sansforgetica, word, audience, non-seen, attitude, Sure seen, 2804","sansforgetica, non-word, broblem, non-seen, brives, Sure not seen, 2255","sansforgetica, non-word, sligince, seen, sligince, Sure seen, 2744","sansforgetica, non-word, disculates, seen, disculates, Sure seen, 1688","sansforgetica, word, drawn, seen, drawn, Sure seen, 1320","sansforgetica, word, seeing, non-seen, security, Probably not seen, 1971","sansforgetica, word, smaller, non-seen, slowly, Sure not seen, 1870","2484650","25-04-2019 11:30"
"yes","Graphic designer","2","sansforgetica, non-word, tunning, Sure word, 5130","sansforgetica, non-word, uncessified, Probably word, 4703","sansforgetica, word, though, Sure word, 1901","sansforgetica, word, higher, Sure word, 3077","sansforgetica, word, awful, Sure word, 1474","sansforgetica, non-word, littor, Probably word, 4298","sansforgetica, non-word, surtine, Probably non-word, 4358","sansforgetica, non-word, inverstand, Probably non-word, 2900","sansforgetica, word, carefully, Sure word, 1542","sansforgetica, non-word, vegitatork, Probably non-word, 4763","sansforgetica, non-word, heroad, Probably non-word, 2875","sansforgetica, non-word, decial, Probably word, 4194","sansforgetica, word, promised, Sure word, 1400","sansforgetica, word, corner, Sure word, 1041","sansforgetica, word, reality, Sure word, 1277","sansforgetica, word, financial, Sure word, 1770","sansforgetica, non-word, softwall, Probably non-word, 5906","sansforgetica, non-word, leasted, Probably non-word, 2236","sansforgetica, word, sharp, Sure word, 1452","sansforgetica, word, major, Sure word, 1072","65","easy to read","arial, word, finding, non-seen, financial, Probably seen, 4703","arial, non-word, vegitatork, seen, vegitatork, Sure seen, 1500","arial, word, reality, seen, reality, Sure seen, 2596","arial, word, thought, non-seen, though, Sure seen, 4113","arial, word, corner, seen, corner, Sure seen, 1287","arial, non-word, tunning, seen, tunning, Sure seen, 1336","arial, word, proper, non-seen, promised, Probably not seen, 2226","arial, word, major, seen, major, Sure seen, 2012","arial, non-word, susining, non-seen, surtine, Probably not seen, 3022","arial, word, carry, non-seen, carefully, Sure seen, 1745","arial, non-word, uncessified, seen, uncessified, Sure seen, 1632","arial, non-word, littor, seen, littor, Sure seen, 1367","arial, non-word, leasumated, non-seen, leasted, Sure not seen, 3182","arial, non-word, sollaren, non-seen, softwall, Probably seen, 4448","arial, word, sharp, seen, sharp, Sure seen, 1237","arial, non-word, hervent, non-seen, heroad, Probably not seen, 2033","arial, non-word, counticks, Probably non-word, 5376","arial, non-word, brisis, Probably non-word, 1892","arial, non-word, defernable, Probably word, 1892","arial, non-word, mingine, Probably non-word, 3334","arial, word, spring, Sure word, 1524","arial, word, gently, Sure word, 1228","arial, word, placed, Sure word, 901","arial, word, begins, Sure word, 1033","arial, word, physical, Sure word, 976","arial, non-word, nords, Probably word, 2423","arial, non-word, elanciences, Probably non-word, 2252","arial, non-word, viried, Probably non-word, 1581","arial, non-word, weises, Probably non-word, 1794","arial, non-word, misher, Probably non-word, 1008","arial, word, surprise, Sure word, 1288","arial, non-word, dictrised, Probably non-word, 3690","arial, word, dollars, Sure word, 1254","arial, word, hands, Sure word, 1016","arial, word, would, Sure word, 1039","arial, word, before, Sure word, 763","65","very easy to read","sansforgetica, non-word, differsive, non-seen, dictrised, Probably not seen, 4002","sansforgetica, non-word, elanciences, seen, elanciences, Probably not seen, 4137","sansforgetica, word, behaviour, non-seen, begins, Sure seen, 2066","sansforgetica, word, placed, seen, placed, Sure seen, 1612","sansforgetica, non-word, minglem, non-seen, mingine, Sure not seen, 3309","sansforgetica, non-word, misher, seen, misher, Sure seen, 1949","sansforgetica, word, picked, non-seen, physical, Probably not seen, 2687","sansforgetica, non-word, defernable, seen, defernable, Sure seen, 1792","sansforgetica, word, getting, non-seen, gently, Probably not seen, 2852","sansforgetica, word, spring, seen, spring, Sure seen, 1311","sansforgetica, non-word, viried, seen, viried, Sure seen, 1884","sansforgetica, non-word, norectly, non-seen, nords, Probably not seen, 2473","sansforgetica, non-word, weitair, non-seen, weises, Probably seen, 4776","sansforgetica, word, doors, non-seen, dollars, Sure seen, 1662","sansforgetica, word, surprise, seen, surprise, Sure seen, 1418","sansforgetica, word, hands, seen, hands, Sure seen, 910","2484534","25-04-2019 11:23"
