"yes","Other designer","2","arial, non-word, vegitorken, Sure non-word, 3587","arial, word, talked, Sure word, 1700","arial, non-word, appressite, Probably non-word, 2900","arial, word, hundreds, Sure word, 2787","arial, word, treated, Sure word, 2741","arial, non-word, edgins, Probably non-word, 4015","arial, non-word, frantage, Probably non-word, 2156","arial, word, recognize, Sure word, 2355","arial, non-word, capossed, Sure non-word, 4092","arial, non-word, disarruping, Sure non-word, 4212","arial, non-word, opplanation, Probably non-word, 3770","arial, word, match, Sure word, 1443","arial, non-word, assumendent, Probably non-word, 5461","arial, non-word, reasonatic, Sure non-word, 6308","arial, word, easily, Sure word, 1520","arial, word, someone, Sure word, 1618","arial, non-word, popubligals, Sure non-word, 4302","arial, word, rising, Sure word, 1412","arial, word, island, Sure word, 1518","arial, word, brain, Sure word, 1756","40","easy to read","sansforgetica, word, something, non-seen, someone, Sure seen, 4000","sansforgetica, non-word, assumendent, seen, assumendent, Sure seen, 3005","sansforgetica, word, taste, non-seen, talked, Sure not seen, 4493","sansforgetica, non-word, disarruping, seen, disarruping, Sure seen, 2664","sansforgetica, non-word, capossed, seen, capossed, Sure seen, 2372","sansforgetica, word, easily, seen, easily, Sure seen, 1489","sansforgetica, non-word, frantage, seen, frantage, Probably seen, 3562","sansforgetica, word, island, seen, island, Sure seen, 1373","sansforgetica, non-word, editifice, non-seen, edgins, Probably not seen, 2292","sansforgetica, word, river, non-seen, rising, Probably not seen, 2084","sansforgetica, word, brain, seen, brain, Sure seen, 1381","sansforgetica, non-word, vehients, non-seen, vegitorken, Probably not seen, 2937","sansforgetica, non-word, apprest, non-seen, appressite, Probably seen, 2005","sansforgetica, word, husband, non-seen, hundreds, Sure not seen, 3002","sansforgetica, non-word, possecapped, non-seen, popubligals, Probably seen, 1967","sansforgetica, word, recognize, seen, recognize, Probably seen, 1749","sansforgetica, word, looks, Sure word, 4080","sansforgetica, non-word, undonestes, Probably non-word, 8753","sansforgetica, non-word, indernoom, Probably non-word, 2568","sansforgetica, word, degree, Sure word, 1728","sansforgetica, non-word, frafering, Probably non-word, 4600","sansforgetica, non-word, sunget, Sure non-word, 3351","sansforgetica, word, interesting, Sure word, 26480","sansforgetica, non-word, governmence, Probably non-word, 10931","sansforgetica, non-word, systed, Probably non-word, 1725","sansforgetica, word, appropriate, Sure word, 2353","sansforgetica, word, accepted, Sure word, 1325","sansforgetica, non-word, greathant, Probably non-word, 5109","sansforgetica, word, merely, Probably word, 2850","sansforgetica, word, bought, Sure word, 1929","sansforgetica, word, details, Sure word, 1341","sansforgetica, word, really, Sure word, 1878","sansforgetica, non-word, minalry, Probably word, 6480","sansforgetica, word, drive, Sure word, 1713","sansforgetica, non-word, apprest, Probably non-word, 1882","sansforgetica, non-word, trads, Sure non-word, 2576","35","difficult to read","arial, non-word, frafering, seen, frafering, Sure seen, 6213","arial, non-word, undonestes, seen, undonestes, Probably seen, 2258","arial, word, looks, seen, looks, Probably seen, 2466","arial, word, introduced, non-seen, interesting, Probably not seen, 2701","arial, word, determined, non-seen, details, Probably not seen, 1839","arial, word, accident, non-seen, accepted, Sure not seen, 1917","arial, non-word, syster, non-seen, systed, Probably not seen, 3203","arial, word, driving, non-seen, drive, Sure seen, 1504","arial, word, merely, seen, merely, Sure seen, 1683","arial, non-word, tragmated, non-seen, trads, Probably seen, 1966","arial, non-word, indernoom, seen, indernoom, Sure seen, 2504","arial, non-word, goverpream, non-seen, governmence, Sure seen, 2889","arial, non-word, minefic, non-seen, minalry, Probably seen, 3637","arial, non-word, sunget, seen, sunget, Probably not seen, 1856","arial, word, appropriate, seen, appropriate, Probably seen, 2563","arial, word, degree, seen, degree, Sure seen, 1417","2347448","14-04-2019 08:40"
"yes","Letter designer","2","arial, word, public, Sure word, 2901","arial, word, began, Sure word, 1955","arial, word, served, Sure word, 2398","arial, word, dress, Sure word, 1734","arial, word, guilty, Sure word, 2334","arial, non-word, itaters, Probably non-word, 4688","arial, non-word, autteuvrity, Sure non-word, 1634","arial, non-word, legulations, Sure non-word, 2648","arial, word, hours, Sure word, 1948","arial, non-word, successity, Probably non-word, 3016","arial, word, record, Sure word, 2086","arial, word, least, Sure word, 1625","arial, word, forward, Sure word, 1963","arial, non-word, morward, Sure non-word, 3721","arial, non-word, aboup, Sure non-word, 4759","arial, non-word, espernence, Probably non-word, 2440","arial, non-word, upbelf, Probably non-word, 4173","arial, non-word, remernal, Probably non-word, 2223","arial, word, would, Sure word, 1950","arial, non-word, clesh, Probably non-word, 3189","65","easy to read","sansforgetica, word, beginning, non-seen, began, Sure not seen, 6138","sansforgetica, word, reduced, non-seen, record, Sure not seen, 2895","sansforgetica, non-word, espernence, seen, espernence, Probably seen, 7551","sansforgetica, non-word, succuader, non-seen, successity, Probably not seen, 4541","sansforgetica, word, would, seen, would, Sure seen, 2019","sansforgetica, word, published, non-seen, public, Sure not seen, 2115","sansforgetica, non-word, aboup, seen, aboup, Sure seen, 2194","sansforgetica, non-word, legulations, seen, legulations, Sure seen, 1850","sansforgetica, word, guilty, seen, guilty, Sure seen, 1885","sansforgetica, non-word, remernal, seen, remernal, Probably seen, 5633","sansforgetica, word, served, seen, served, Probably seen, 3069","sansforgetica, word, found, non-seen, forward, Probably not seen, 4211","sansforgetica, non-word, auttlefites, non-seen, autteuvrity, Probably not seen, 3769","sansforgetica, non-word, cloature, non-seen, clesh, Probably not seen, 3840","sansforgetica, word, least, seen, least, Sure seen, 1930","sansforgetica, non-word, immediative, non-seen, itaters, Probably not seen, 4880","sansforgetica, word, bought, Sure word, 4870","sansforgetica, word, captain, Sure word, 1837","sansforgetica, word, scientific, Sure word, 2231","sansforgetica, word, birth, Sure word, 1685","sansforgetica, non-word, retter, Probably non-word, 2201","sansforgetica, word, became, Sure word, 1947","sansforgetica, non-word, shought, Probably non-word, 3624","sansforgetica, non-word, birst, Probably non-word, 2581","sansforgetica, non-word, occalution, Probably non-word, 3239","sansforgetica, non-word, rutongance, Probably non-word, 3961","sansforgetica, non-word, enreloping, Sure non-word, 2483","sansforgetica, word, horses, Sure word, 1822","sansforgetica, word, performance, Sure word, 2033","sansforgetica, non-word, countenth, Probably non-word, 4266","sansforgetica, non-word, couled, Probably non-word, 1906","sansforgetica, word, compared, Sure word, 1800","sansforgetica, non-word, huntain, Probably non-word, 5396","sansforgetica, word, traditional, Sure word, 1756","sansforgetica, non-word, hanposed, Sure non-word, 2985","sansforgetica, word, evidence, Sure word, 1954","45","difficult to read","arial, word, because, non-seen, became, Probably not seen, 4542","arial, non-word, couled, seen, couled, Sure seen, 2701","arial, word, captain, seen, captain, Sure seen, 1788","arial, non-word, rutongance, seen, rutongance, Probably not seen, 2214","arial, non-word, shound, non-seen, shought, Probably not seen, 6470","arial, non-word, occational, non-seen, occalution, Probably seen, 2615","arial, non-word, counticks, non-seen, countenth, Probably not seen, 3996","arial, word, black, non-seen, birth, Probably not seen, 2442","arial, word, performance, seen, performance, Sure seen, 1478","arial, word, traffic, non-seen, traditional, Sure not seen, 4153","arial, word, bought, seen, bought, Probably seen, 2539","arial, non-word, huntain, seen, huntain, Sure seen, 2467","arial, non-word, blace, non-seen, birst, Probably not seen, 2647","arial, word, exactly, non-seen, evidence, Probably not seen, 4255","arial, non-word, retter, seen, retter, Probably not seen, 1817","arial, word, scientific, seen, scientific, Sure seen, 1825","2345029","14-04-2019 04:43"
"yes","Non-designer","2","sansforgetica, word, western, Sure word, 2818","sansforgetica, word, strike, Sure word, 1602","sansforgetica, non-word, remangth, Sure non-word, 4889","sansforgetica, word, recent, Sure word, 1873","sansforgetica, word, actions, Sure word, 1669","sansforgetica, non-word, birst, Probably word, 3067","sansforgetica, word, recently, Sure word, 1114","sansforgetica, non-word, tempriation, Sure word, 2424","sansforgetica, word, develop, Sure word, 2045","sansforgetica, non-word, grened, Probably non-word, 4307","sansforgetica, non-word, ultomobile, Probably non-word, 3353","sansforgetica, non-word, leacted, Probably non-word, 2746","sansforgetica, non-word, vally, Sure word, 2017","sansforgetica, non-word, shought, Probably word, 4757","sansforgetica, word, council, Sure word, 1993","sansforgetica, word, organized, Sure word, 2507","sansforgetica, non-word, winnic, Probably word, 5023","sansforgetica, non-word, diffesses, Probably non-word, 3703","sansforgetica, word, pleasure, Sure word, 2203","sansforgetica, word, influence, Sure word, 2230","50","difficult to read","arial, word, recent, seen, recent, Sure seen, 3130","arial, word, count, non-seen, council, Probably not seen, 2492","arial, non-word, grened, seen, grened, Sure seen, 1671","arial, non-word, tersuact, non-seen, tempriation, Probably not seen, 2777","arial, word, strong, non-seen, strike, Probably seen, 2882","arial, non-word, umbrated, non-seen, ultomobile, Probably not seen, 2459","arial, non-word, vally, seen, vally, Sure seen, 1284","arial, word, original, non-seen, organized, Sure seen, 1742","arial, non-word, winnic, seen, winnic, Sure seen, 2709","arial, word, plenty, non-seen, pleasure, Probably not seen, 1972","arial, non-word, shound, non-seen, shought, Sure seen, 2708","arial, word, recently, seen, recently, Sure seen, 1468","arial, word, develop, seen, develop, Probably not seen, 3149","arial, non-word, blace, non-seen, birst, Sure seen, 2302","arial, word, actions, seen, actions, Sure not seen, 2759","arial, non-word, leacted, seen, leacted, Sure seen, 2516","arial, non-word, cloature, Probably non-word, 5040","arial, word, notes, Sure word, 1318","arial, word, practice, Sure word, 1532","arial, word, watching, Sure word, 1375","arial, non-word, compritable, Sure non-word, 3220","arial, non-word, numals, Probably non-word, 2930","arial, non-word, outting, Probably word, 2800","arial, non-word, sechniall, Sure non-word, 2183","arial, word, plastic, Sure word, 1677","arial, word, likely, Sure word, 1265","arial, non-word, suronder, Sure non-word, 2625","arial, word, plenty, Sure word, 1174","arial, non-word, oppech, Sure non-word, 2702","arial, word, crisis, Sure word, 1196","arial, word, looking, Sure word, 995","arial, non-word, althdren, Sure non-word, 2940","arial, non-word, commishors, Probably non-word, 3066","arial, non-word, therinder, Sure non-word, 2918","arial, word, production, Sure word, 1099","arial, word, individual, Sure word, 1801","50","very easy to read","sansforgetica, non-word, therinder, seen, therinder, Sure seen, 4675","sansforgetica, word, likely, seen, likely, Sure seen, 1734","sansforgetica, word, looking, seen, looking, Sure seen, 3189","sansforgetica, non-word, collainess, non-seen, cloature, Sure not seen, 3360","sansforgetica, non-word, commishors, seen, commishors, Sure seen, 2074","sansforgetica, non-word, compritable, seen, compritable, Probably seen, 4841","sansforgetica, word, production, seen, production, Probably seen, 2258","sansforgetica, word, industrial, non-seen, individual, Sure not seen, 1998","sansforgetica, word, played, non-seen, plastic, Sure not seen, 2361","sansforgetica, non-word, althount, non-seen, althdren, Sure seen, 1885","sansforgetica, non-word, opperal, non-seen, oppech, Sure not seen, 2276","sansforgetica, word, plenty, seen, plenty, Sure seen, 1456","sansforgetica, non-word, sechniall, seen, sechniall, Probably seen, 4158","sansforgetica, word, water, non-seen, watching, Sure not seen, 1993","sansforgetica, word, nothing, non-seen, notes, Sure not seen, 3008","sansforgetica, non-word, overible, non-seen, outting, Sure not seen, 2271","2343760","14-04-2019 00:55"
"yes","Non-designer","2","sansforgetica, word, treated, Sure word, 2362","sansforgetica, non-word, neiminate, Sure non-word, 4682","sansforgetica, word, claim, Sure word, 1726","sansforgetica, non-word, centent, Sure non-word, 2756","sansforgetica, non-word, medgy, Sure non-word, 1403","sansforgetica, non-word, specket, Sure non-word, 1691","sansforgetica, word, interest, Sure word, 1428","sansforgetica, non-word, laucied, Sure non-word, 3245","sansforgetica, non-word, explaign, Sure non-word, 1987","sansforgetica, word, leader, Sure word, 1589","sansforgetica, non-word, glizagely, Sure non-word, 1809","sansforgetica, word, reaction, Sure word, 1396","sansforgetica, non-word, suppoing, Probably non-word, 4584","sansforgetica, word, married, Sure word, 1347","sansforgetica, non-word, compritable, Sure non-word, 3772","sansforgetica, word, tonight, Sure word, 1368","sansforgetica, word, least, Sure word, 2335","sansforgetica, non-word, gazark, Probably non-word, 3325","sansforgetica, word, beauty, Sure word, 1910","sansforgetica, word, lower, Sure word, 1586","70","ok","arial, non-word, specket, seen, specket, Sure seen, 2112","arial, non-word, centent, seen, centent, Sure seen, 1213","arial, word, interesting, non-seen, interest, Sure seen, 1420","arial, word, lunch, non-seen, lower, Sure not seen, 2175","arial, non-word, gnaning, non-seen, glizagely, Sure not seen, 1420","arial, word, reaction, seen, reaction, Probably seen, 3634","arial, non-word, gazark, seen, gazark, Sure seen, 1363","arial, non-word, meeterts, non-seen, medgy, Sure not seen, 1961","arial, word, claim, seen, claim, Sure seen, 1644","arial, word, tonight, seen, tonight, Sure seen, 977","arial, non-word, explanented, non-seen, explaign, Sure not seen, 3875","arial, word, leaves, non-seen, least, Sure not seen, 1587","arial, word, massive, non-seen, married, Sure not seen, 997","arial, word, treated, seen, treated, Probably seen, 1680","arial, non-word, laucied, seen, laucied, Sure seen, 1442","arial, non-word, surcenters, non-seen, suppoing, Probably not seen, 2450","arial, non-word, clesh, Probably non-word, 7885","arial, non-word, thouggle, Sure non-word, 3167","arial, word, parts, Sure word, 1602","arial, word, recently, Sure word, 1806","arial, non-word, deterienth, Sure non-word, 2858","arial, word, decade, Sure word, 1436","arial, word, computer, Sure word, 856","arial, word, takes, Sure word, 896","arial, non-word, afrifite, Probably non-word, 2029","arial, non-word, tommon, Probably non-word, 1235","arial, word, highly, Sure word, 2835","arial, non-word, promatic, Probably word, 2266","arial, word, playing, Sure word, 1269","arial, word, covered, Sure word, 1757","arial, word, independent, Sure word, 1516","arial, non-word, faitain, Probably non-word, 4538","arial, non-word, worls, Probably non-word, 2254","arial, non-word, outel, Probably word, 2119","arial, word, streets, Sure word, 1253","arial, non-word, favies, Probably word, 1972","74","very easy to read","sansforgetica, non-word, promatic, seen, promatic, Probably seen, 2606","sansforgetica, non-word, worwars, non-seen, worls, Sure not seen, 1873","sansforgetica, non-word, devulaing, non-seen, deterienth, Sure not seen, 1794","sansforgetica, word, covered, seen, covered, Sure seen, 1618","sansforgetica, non-word, clesh, seen, clesh, Sure seen, 1225","sansforgetica, non-word, thouggle, seen, thouggle, Sure seen, 885","sansforgetica, word, takes, seen, takes, Probably seen, 6615","sansforgetica, word, pleased, non-seen, playing, Probably not seen, 2265","sansforgetica, non-word, feanspore, non-seen, favies, Sure not seen, 1631","sansforgetica, word, highly, seen, highly, Sure seen, 1559","sansforgetica, word, individual, non-seen, independent, Sure not seen, 2073","sansforgetica, word, decided, non-seen, decade, Sure not seen, 1415","sansforgetica, word, recently, seen, recently, Sure seen, 1386","sansforgetica, non-word, outel, seen, outel, Sure seen, 987","sansforgetica, non-word, tosing, non-seen, tommon, Sure not seen, 1585","sansforgetica, word, concern, non-seen, computer, Sure not seen, 2861","2343732","14-04-2019 00:34"
"yes","Letter designer","2","arial, non-word, dwayed, Probably non-word, 3204","arial, non-word, chares, Probably non-word, 1782","arial, word, scene, Sure word, 1639","arial, non-word, strashism, Probably non-word, 2321","arial, non-word, husbage, Probably non-word, 1811","arial, non-word, eviable, Probably non-word, 3868","arial, non-word, cerfested, Probably non-word, 1923","arial, word, stared, Sure word, 1733","arial, word, awful, Sure word, 1954","arial, word, during, Sure word, 1025","arial, word, grass, Sure word, 975","arial, non-word, arrearature, Probably non-word, 3602","arial, word, someone, Sure word, 1570","arial, non-word, assolution, Probably non-word, 2484","arial, word, interest, Sure word, 1655","arial, non-word, numals, Probably non-word, 2016","arial, word, soldiers, Sure word, 1586","arial, non-word, mastruntion, Probably non-word, 2774","arial, word, wearing, Sure word, 1710","arial, word, older, Sure word, 1790","26","easy to read","sansforgetica, word, during, seen, during, Sure seen, 3961","sansforgetica, non-word, hysturably, non-seen, husbage, Sure not seen, 2305","sansforgetica, non-word, eviderood, non-seen, eviable, Sure not seen, 3397","sansforgetica, word, interesting, non-seen, interest, Probably not seen, 3734","sansforgetica, non-word, mastruntion, seen, mastruntion, Sure not seen, 2282","sansforgetica, non-word, assues, non-seen, assolution, Sure not seen, 1836","sansforgetica, non-word, chason, non-seen, chares, Sure not seen, 3688","sansforgetica, word, weather, non-seen, wearing, Sure not seen, 1296","sansforgetica, non-word, dwayed, seen, dwayed, Probably seen, 3868","sansforgetica, word, grass, seen, grass, Sure seen, 1719","sansforgetica, non-word, cerfested, seen, cerfested, Sure seen, 2076","sansforgetica, word, opened, non-seen, older, Sure not seen, 2603","sansforgetica, word, awful, seen, awful, Sure seen, 2219","sansforgetica, word, stared, seen, stared, Sure seen, 2710","sansforgetica, non-word, arrearature, seen, arrearature, Probably not seen, 4454","sansforgetica, word, solution, non-seen, soldiers, Probably not seen, 2852","sansforgetica, non-word, docionating, Probably non-word, 5595","sansforgetica, word, involved, Sure word, 1970","sansforgetica, word, spite, Sure word, 2265","sansforgetica, non-word, irrection, Probably non-word, 3312","sansforgetica, word, plants, Sure word, 1780","sansforgetica, non-word, guatiammer, Probably non-word, 7921","sansforgetica, non-word, worwars, Sure non-word, 4360","sansforgetica, word, increasing, Sure word, 1828","sansforgetica, non-word, trutal, Sure non-word, 2664","sansforgetica, word, undefined, Sure non-word, 7664","sansforgetica, word, partly, Sure word, 1790","sansforgetica, non-word, undustomes, Sure non-word, 4951","sansforgetica, non-word, depending, Sure word, 1689","sansforgetica, word, murder, Sure word, 2477","sansforgetica, non-word, guars, Probably non-word, 2423","sansforgetica, word, empty, Sure word, 1585","sansforgetica, word, getting, Sure word, 2334","sansforgetica, non-word, seteriship, Probably non-word, 4360","sansforgetica, word, check, Sure word, 1736","sansforgetica, non-word, conventment, Probably non-word, 4640","50","difficult to read","arial, word, ended, non-seen, empty, Sure not seen, 6718","arial, word, spite, seen, spite, Sure seen, 1852","arial, word, chief, non-seen, check, Sure not seen, 2218","arial, non-word, coods, non-seen, conventment, Sure not seen, 1500","arial, word, undefined, seen, undefined, Sure not seen, 2836","arial, non-word, undustomes, seen, undustomes, Sure seen, 2969","arial, word, partly, seen, partly, Sure not seen, 3288","arial, non-word, itaters, non-seen, irrection, Sure not seen, 1914","arial, non-word, docionating, seen, docionating, Sure not seen, 1524","arial, word, island, non-seen, involved, Sure not seen, 1274","arial, word, getting, seen, getting, Sure not seen, 1304","arial, non-word, tunning, non-seen, trutal, Sure not seen, 1142","arial, non-word, worwars, seen, worwars, Sure seen, 1882","arial, non-word, guatiammer, seen, guatiammer, Probably seen, 3970","arial, word, plastic, non-seen, plants, Sure not seen, 3092","arial, non-word, guarpapers, non-seen, guars, Sure not seen, 2781","2343715","14-04-2019 00:26"
"yes","Letter designer","2","arial, non-word, gatisient, Sure non-word, 2256","arial, non-word, surtine, Sure word, 1649","arial, word, reality, Sure word, 1059","arial, word, later, Sure word, 857","arial, non-word, direndly, Sure non-word, 2022","arial, word, industrial, Sure word, 1036","arial, word, match, Sure word, 1020","arial, non-word, arrearature, Sure non-word, 1800","arial, non-word, untin, Sure word, 1345","arial, word, future, Sure word, 1136","arial, non-word, afficled, Sure non-word, 1545","arial, word, sudden, Sure word, 1026","arial, word, thirty, Sure word, 999","arial, non-word, denerstion, Sure word, 1268","arial, word, servants, Sure word, 1096","arial, word, became, Sure word, 1086","arial, non-word, matragants, Sure non-word, 1544","arial, non-word, admistion, Sure word, 1831","arial, non-word, incression, Sure word, 1980","arial, word, chief, Sure word, 1072","80","very easy to read","sansforgetica, word, because, non-seen, became, Sure not seen, 11575","sansforgetica, non-word, deparations, non-seen, denerstion, Sure not seen, 1806","sansforgetica, word, match, seen, match, Sure seen, 2155","sansforgetica, non-word, gatisient, seen, gatisient, Sure seen, 1455","sansforgetica, non-word, mayer, non-seen, matragants, Sure not seen, 2665","sansforgetica, word, industrial, seen, industrial, Sure seen, 2419","sansforgetica, non-word, admiter, non-seen, admistion, Probably seen, 4578","sansforgetica, word, those, non-seen, thirty, Sure not seen, 3470","sansforgetica, word, sugar, non-seen, sudden, Sure not seen, 2004","sansforgetica, non-word, unwiliate, non-seen, untin, Sure not seen, 1817","sansforgetica, word, children, non-seen, chief, Sure not seen, 1536","sansforgetica, non-word, incression, seen, incression, Sure seen, 4199","sansforgetica, word, reality, seen, reality, Sure seen, 3470","sansforgetica, non-word, surtine, seen, surtine, Sure seen, 3164","sansforgetica, word, later, seen, later, Sure seen, 934","sansforgetica, non-word, arrearature, seen, arrearature, Sure seen, 1416","sansforgetica, non-word, minefic, Sure non-word, 3624","sansforgetica, word, looks, Sure word, 1896","sansforgetica, non-word, govermists, Sure non-word, 3902","sansforgetica, word, looking, Sure word, 4559","sansforgetica, word, practice, Sure word, 1439","sansforgetica, non-word, exisonent, Sure non-word, 4317","sansforgetica, non-word, soctic, Sure non-word, 4184","sansforgetica, word, prepared, Sure word, 2901","sansforgetica, non-word, catiquition, Sure word, 2303","sansforgetica, non-word, indesphant, Sure word, 3756","sansforgetica, word, powerful, Sure word, 5127","sansforgetica, word, phone, Sure word, 1173","sansforgetica, non-word, withous, Sure non-word, 2175","sansforgetica, non-word, feanspore, Sure non-word, 3865","sansforgetica, word, always, Sure word, 1372","sansforgetica, word, stage, Sure word, 944","sansforgetica, word, first, Sure word, 924","sansforgetica, word, slowly, Sure word, 1175","sansforgetica, non-word, disculative, Sure word, 3525","sansforgetica, non-word, grandials, Sure word, 1636","70","ok","arial, word, presence, non-seen, prepared, Probably not seen, 9757","arial, non-word, expeantly, non-seen, exisonent, Sure not seen, 4097","arial, word, loved, non-seen, looks, Sure not seen, 8255","arial, non-word, catuirented, non-seen, catiquition, Sure seen, 43635","arial, non-word, feanspore, seen, feanspore, Sure seen, 1483","arial, non-word, indifferely, non-seen, indesphant, Sure not seen, 6095","arial, non-word, disculative, seen, disculative, Sure seen, 1448","arial, non-word, govermists, seen, govermists, Sure seen, 1056","arial, word, looking, seen, looking, Sure not seen, 6536","arial, word, practical, non-seen, powerful, Sure not seen, 1565","arial, word, slowly, seen, slowly, Sure not seen, 1525","arial, word, phone, seen, phone, Sure seen, 1130","arial, non-word, minest, non-seen, minefic, Sure seen, 978","arial, word, always, seen, always, Sure seen, 1423","arial, non-word, withous, seen, withous, Sure seen, 1183","arial, word, fishing, non-seen, first, Sure seen, 1428","2343685","13-04-2019 23:55"
