"yes","Non-designer","2","sansforgetica, word, lovely, Sure word, 2275","sansforgetica, word, table, Sure word, 1878","sansforgetica, non-word, afficled, Probably word, 3108","sansforgetica, non-word, calate, Probably non-word, 3062","sansforgetica, word, whose, Sure word, 2544","sansforgetica, non-word, syntished, Sure non-word, 3724","sansforgetica, non-word, regetching, Probably non-word, 2767","sansforgetica, non-word, cerving, Probably non-word, 2488","sansforgetica, word, looking, Sure word, 1821","sansforgetica, non-word, lunds, Probably word, 2743","sansforgetica, word, massive, Sure word, 2001","sansforgetica, word, accepted, Sure word, 2106","sansforgetica, non-word, evere, Probably non-word, 2979","sansforgetica, word, population, Sure word, 1920","sansforgetica, non-word, reginning, Sure non-word, 2434","sansforgetica, word, wondered, Sure word, 1808","sansforgetica, word, instance, Sure word, 1627","sansforgetica, non-word, catuirented, Probably non-word, 2232","sansforgetica, word, methods, Sure word, 1844","sansforgetica, non-word, eather, Probably word, 3175","67","ok","arial, word, wondered, seen, wondered, Sure seen, 3647","arial, non-word, lunds, seen, lunds, Sure seen, 1934","arial, non-word, systed, non-seen, syntished, Sure seen, 1689","arial, non-word, cerving, seen, cerving, Sure seen, 1793","arial, word, lower, non-seen, lovely, Sure not seen, 2545","arial, non-word, afrifite, non-seen, afficled, Probably not seen, 2426","arial, word, massive, seen, massive, Sure seen, 1546","arial, word, population, seen, population, Sure seen, 1628","arial, non-word, regetching, seen, regetching, Sure seen, 2139","arial, non-word, calate, seen, calate, Sure seen, 1683","arial, word, window, non-seen, whose, Sure not seen, 2457","arial, non-word, edgins, non-seen, eather, Probably not seen, 2043","arial, word, instead, non-seen, instance, Probably not seen, 1927","arial, word, accepted, seen, accepted, Sure seen, 1822","arial, non-word, caughtly, non-seen, catuirented, Probably not seen, 2378","arial, word, middle, non-seen, methods, Probably not seen, 1849","arial, word, approach, Sure word, 1832","arial, non-word, specination, Probably non-word, 3293","arial, non-word, beight, Probably non-word, 2165","arial, word, again, Sure word, 1645","arial, word, obviously, Sure word, 1610","arial, non-word, varefully, Probably non-word, 2036","arial, word, appearance, Sure word, 1699","arial, non-word, considance, Probably word, 2158","arial, non-word, examped, Probably non-word, 3331","arial, word, person, Sure word, 1787","arial, non-word, plandstions, Probably non-word, 2662","arial, non-word, genastially, Probably non-word, 1936","arial, word, particular, Sure word, 1865","arial, word, cigarette, Sure word, 1902","arial, non-word, lecieve, Probably non-word, 1796","arial, non-word, starned, Probably non-word, 1940","arial, word, private, Sure word, 1636","arial, non-word, somewing, Sure word, 2567","arial, word, scale, Sure word, 1800","arial, word, needed, Sure word, 1894","67","very easy to read","sansforgetica, non-word, exampses, non-seen, examped, Probably not seen, 4825","sansforgetica, word, against, non-seen, again, Probably not seen, 2590","sansforgetica, non-word, steet, non-seen, starned, Probably not seen, 2750","sansforgetica, non-word, genastially, seen, genastially, Sure seen, 1927","sansforgetica, word, person, seen, person, Sure seen, 1588","sansforgetica, non-word, varlies, non-seen, varefully, Probably not seen, 2662","sansforgetica, word, particular, seen, particular, Sure seen, 2667","sansforgetica, word, occasion, non-seen, obviously, Probably not seen, 1764","sansforgetica, non-word, somewing, seen, somewing, Sure seen, 1801","sansforgetica, word, approach, seen, approach, Probably not seen, 2034","sansforgetica, non-word, specination, seen, specination, Sure seen, 2135","sansforgetica, non-word, legan, non-seen, lecieve, Probably not seen, 1809","sansforgetica, word, scene, non-seen, scale, Probably not seen, 1844","sansforgetica, word, needed, seen, needed, Probably not seen, 1908","sansforgetica, non-word, plandstions, seen, plandstions, Sure seen, 1670","sansforgetica, word, probably, non-seen, private, Sure seen, 2191","2340916","13-04-2019 16:04"
"yes","Non-designer","2","sansforgetica, non-word, centoment, Probably word, 3495","sansforgetica, word, dressed, Sure word, 1541","sansforgetica, non-word, nobit, Probably non-word, 3276","sansforgetica, word, worked, Sure word, 1569","sansforgetica, non-word, depernment, Probably non-word, 3911","sansforgetica, non-word, braven, Sure word, 2179","sansforgetica, word, might, Sure word, 1643","sansforgetica, non-word, gromish, Probably word, 2696","sansforgetica, word, proportion, Sure word, 1402","sansforgetica, word, ideas, Sure word, 1246","sansforgetica, non-word, woung, Sure non-word, 3284","sansforgetica, word, should, Sure word, 1541","sansforgetica, word, traditional, Sure word, 1228","sansforgetica, non-word, gensibility, Sure non-word, 5241","sansforgetica, word, therefore, Sure word, 1764","sansforgetica, non-word, macrector, Probably non-word, 2243","sansforgetica, word, evidence, Sure word, 1440","sansforgetica, non-word, distery, Probably non-word, 3076","sansforgetica, word, change, Sure word, 1215","sansforgetica, non-word, amonged, Sure non-word, 2389","42","ok","arial, non-word, cerfested, non-seen, centoment, Sure not seen, 4494","arial, word, changing, non-seen, change, Sure seen, 4593","arial, non-word, woung, seen, woung, Sure seen, 2312","arial, word, therefore, seen, therefore, Sure seen, 1369","arial, word, should, seen, should, Sure seen, 1107","arial, non-word, amonged, seen, amonged, Sure seen, 1773","arial, non-word, gereed, non-seen, gensibility, Sure not seen, 2387","arial, word, image, non-seen, ideas, Sure not seen, 2010","arial, word, might, seen, might, Sure seen, 1454","arial, word, protection, non-seen, proportion, Sure not seen, 1650","arial, non-word, distery, seen, distery, Sure seen, 1929","arial, non-word, derropround, non-seen, depernment, Sure not seen, 1749","arial, non-word, braven, seen, braven, Sure seen, 2551","arial, word, drink, non-seen, dressed, Sure not seen, 1919","arial, non-word, guarpapers, non-seen, gromish, Sure not seen, 1567","arial, word, traditional, seen, traditional, Probably seen, 3074","arial, non-word, drices, Probably non-word, 4795","arial, non-word, improprians, Sure non-word, 3383","arial, word, research, Sure word, 1605","arial, word, discovered, Sure word, 1028","arial, word, eight, Sure word, 933","arial, non-word, exectorial, Probably word, 2617","arial, word, independent, Sure word, 1441","arial, non-word, proception, Sure word, 1825","arial, non-word, corspention, Sure non-word, 2123","arial, non-word, socialing, Probably non-word, 3802","arial, non-word, primals, Sure word, 1781","arial, word, exactly, Sure word, 1007","arial, word, audience, Sure word, 1218","arial, non-word, pasis, Probably non-word, 2085","arial, non-word, tragmated, Probably non-word, 2714","arial, word, shows, Sure word, 1091","arial, word, industry, Sure word, 1077","arial, word, clean, Sure word, 1327","arial, non-word, susining, Sure non-word, 1591","arial, word, record, Sure word, 1103","50","very easy to read","sansforgetica, word, influence, non-seen, industry, Sure not seen, 7506","sansforgetica, non-word, trambling, non-seen, tragmated, Sure not seen, 2343","sansforgetica, word, shows, seen, shows, Sure not seen, 1435","sansforgetica, word, authorities, non-seen, audience, Sure not seen, 1799","sansforgetica, non-word, primals, seen, primals, Sure seen, 1659","sansforgetica, word, research, seen, research, Sure seen, 1707","sansforgetica, non-word, susining, seen, susining, Sure seen, 1921","sansforgetica, non-word, societary, non-seen, socialing, Sure not seen, 1914","sansforgetica, word, exactly, seen, exactly, Sure seen, 2146","sansforgetica, word, reduced, non-seen, record, Sure seen, 2145","sansforgetica, non-word, imputives, non-seen, improprians, Sure not seen, 2047","sansforgetica, word, eight, seen, eight, Sure seen, 1290","sansforgetica, non-word, proception, seen, proception, Sure not seen, 1911","sansforgetica, word, individual, non-seen, independent, Sure seen, 2726","sansforgetica, non-word, drices, seen, drices, Sure seen, 1914","sansforgetica, non-word, patcher, non-seen, pasis, Sure not seen, 1986","2335300","13-04-2019 07:36"
"yes","Non-designer","2","arial, word, royal, Sure word, 4121","arial, non-word, scientable, Sure non-word, 2557","arial, non-word, atter, Sure non-word, 2431","arial, non-word, pretectely, Sure non-word, 3692","arial, non-word, verving, Sure non-word, 5235","arial, non-word, lodieves, Sure non-word, 2440","arial, word, brain, Sure word, 2101","arial, word, became, Sure word, 1921","arial, word, holding, Sure word, 3957","arial, word, shown, Sure word, 1606","arial, non-word, wates, Sure non-word, 7415","arial, word, pieces, Sure word, 1755","arial, non-word, afrifite, Sure non-word, 2484","arial, non-word, expedintly, Sure non-word, 3038","arial, word, needs, Sure word, 1861","arial, non-word, expeativer, Sure non-word, 2561","arial, word, impossible, Sure word, 2377","arial, word, falling, Sure word, 1675","arial, non-word, romoting, Sure non-word, 2023","arial, word, individual, Sure word, 2348","25","easy to read","sansforgetica, word, holding, seen, holding, Probably not seen, 15551","sansforgetica, word, impression, non-seen, impossible, Sure not seen, 2792","sansforgetica, non-word, victurs, non-seen, verving, Sure not seen, 3047","sansforgetica, non-word, pretectely, seen, pretectely, Sure seen, 3217","sansforgetica, non-word, wates, seen, wates, Sure seen, 2319","sansforgetica, non-word, scientable, seen, scientable, Sure seen, 2221","sansforgetica, non-word, experaties, non-seen, expedintly, Sure seen, 6273","sansforgetica, non-word, attermingly, non-seen, atter, Sure not seen, 3373","sansforgetica, word, falling, seen, falling, Sure not seen, 4171","sansforgetica, word, became, seen, became, Sure seen, 1972","sansforgetica, non-word, romoting, seen, romoting, Sure seen, 4591","sansforgetica, non-word, londow, non-seen, lodieves, Sure not seen, 3398","sansforgetica, word, neither, non-seen, needs, Sure seen, 2580","sansforgetica, word, individual, seen, individual, Sure seen, 2198","sansforgetica, word, shows, non-seen, shown, Sure not seen, 2303","sansforgetica, word, rules, non-seen, royal, Probably not seen, 5402","sansforgetica, word, learn, Sure word, 6752","sansforgetica, non-word, fashing, Sure non-word, 2377","sansforgetica, non-word, maithfular, Sure non-word, 3119","sansforgetica, word, significant, Sure word, 3803","sansforgetica, non-word, revernment, Sure non-word, 3153","sansforgetica, non-word, prewing, Sure non-word, 2464","sansforgetica, word, weight, Sure word, 1773","sansforgetica, word, weeks, Sure word, 2245","sansforgetica, non-word, moundays, Sure non-word, 2323","sansforgetica, word, minister, Sure word, 2175","sansforgetica, non-word, expectively, Sure non-word, 2102","sansforgetica, word, afraid, Sure word, 2295","sansforgetica, non-word, utilograble, Sure non-word, 3250","sansforgetica, word, accepted, Sure word, 1898","sansforgetica, non-word, pariods, Sure non-word, 2821","sansforgetica, word, themselves, Sure word, 2113","sansforgetica, word, streets, Sure word, 1807","sansforgetica, word, details, Sure word, 1677","sansforgetica, non-word, discright, Sure non-word, 2417","sansforgetica, non-word, ruscle, Sure non-word, 2581","42","very difficult to read","arial, word, accepted, seen, accepted, Probably not seen, 4494","arial, non-word, revernment, seen, revernment, Sure seen, 3413","arial, non-word, pariods, seen, pariods, Sure seen, 1989","arial, word, learning, non-seen, learn, Sure seen, 1859","arial, word, weeks, seen, weeks, Sure seen, 2052","arial, non-word, rutogement, non-seen, ruscle, Probably not seen, 4227","arial, word, strength, non-seen, streets, Probably not seen, 2990","arial, word, details, seen, details, Probably not seen, 5361","arial, non-word, utimunation, non-seen, utilograble, Sure not seen, 4687","arial, non-word, discrings, non-seen, discright, Probably not seen, 3426","arial, word, minute, non-seen, minister, Sure not seen, 2609","arial, non-word, fashing, seen, fashing, Sure seen, 1904","arial, word, themselves, seen, themselves, Sure seen, 2139","arial, non-word, expections, non-seen, expectively, Sure seen, 2350","arial, non-word, moundays, seen, moundays, Sure seen, 1691","arial, word, welfare, non-seen, weight, Sure not seen, 2036","2334359","13-04-2019 06:00"
"yes","Non-designer","2","sansforgetica, word, freedom, Sure word, 3449","sansforgetica, non-word, complefient, Sure non-word, 3299","sansforgetica, non-word, resperation, Sure non-word, 2406","sansforgetica, word, places, Sure word, 2359","sansforgetica, non-word, nommidated, Sure non-word, 2539","sansforgetica, word, window, Sure word, 1636","sansforgetica, non-word, impreit, Sure non-word, 1850","sansforgetica, non-word, goverpream, Sure non-word, 1995","sansforgetica, non-word, mocietary, Sure non-word, 1953","sansforgetica, word, financial, Sure word, 1695","sansforgetica, non-word, congressary, Sure non-word, 3208","sansforgetica, word, waste, Sure word, 1708","sansforgetica, word, happened, Sure word, 1662","sansforgetica, non-word, arrinst, Sure non-word, 2021","sansforgetica, non-word, withous, Sure non-word, 2070","sansforgetica, word, square, Sure word, 1726","sansforgetica, word, promised, Sure word, 1686","sansforgetica, word, compared, Sure word, 1474","sansforgetica, non-word, voiled, Sure non-word, 2600","sansforgetica, word, information, Sure word, 1431","61","ok","arial, non-word, impriavelly, non-seen, impreit, Sure not seen, 3968","arial, word, square, seen, square, Sure seen, 2433","arial, non-word, nommidated, seen, nommidated, Sure seen, 2604","arial, non-word, restratians, non-seen, resperation, Sure not seen, 2248","arial, non-word, gradboate, non-seen, goverpream, Sure not seen, 1772","arial, non-word, complefient, seen, complefient, Sure seen, 2509","arial, word, watching, non-seen, waste, Sure not seen, 4763","arial, word, happening, non-seen, happened, Sure not seen, 5778","arial, word, plain, non-seen, places, Sure not seen, 1935","arial, non-word, conguage, non-seen, congressary, Sure not seen, 1744","arial, non-word, mocietary, seen, mocietary, Sure seen, 1943","arial, word, compared, seen, compared, Probably seen, 3369","arial, word, financial, seen, financial, Sure seen, 1751","arial, word, proper, non-seen, promised, Probably not seen, 4389","arial, non-word, voiled, seen, voiled, Sure seen, 2359","arial, word, information, seen, information, Sure seen, 1581","arial, word, opening, Sure word, 4463","arial, word, building, Sure word, 1658","arial, word, worth, Sure word, 1428","arial, non-word, restruction, Sure non-word, 2853","arial, non-word, frafering, Sure non-word, 1518","arial, word, common, Sure word, 1862","arial, non-word, newspable, Sure non-word, 1978","arial, word, courses, Sure word, 2071","arial, non-word, brummitic, Sure non-word, 1941","arial, word, driving, Sure word, 1868","arial, word, proved, Sure word, 1424","arial, non-word, breakdous, Sure non-word, 1779","arial, non-word, matitary, Sure non-word, 2654","arial, non-word, sucling, Sure non-word, 1656","arial, non-word, stich, Sure non-word, 2057","arial, word, prevent, Sure word, 1787","arial, word, greatest, Sure word, 1319","arial, word, somewhat, Sure word, 1396","arial, non-word, hartilment, Sure non-word, 1861","arial, non-word, coods, Sure non-word, 3237","62","very easy to read","sansforgetica, word, previous, non-seen, prevent, Probably seen, 4295","sansforgetica, non-word, restruction, seen, restruction, Probably seen, 6572","sansforgetica, word, opening, seen, opening, Sure seen, 3116","sansforgetica, non-word, matitary, seen, matitary, Sure seen, 1692","sansforgetica, word, somewhat, seen, somewhat, Sure seen, 1486","sansforgetica, word, proved, seen, proved, Probably seen, 3497","sansforgetica, word, built, non-seen, building, Probably seen, 3619","sansforgetica, non-word, cormaning, non-seen, coods, Sure not seen, 7646","sansforgetica, word, court, non-seen, courses, Sure seen, 4862","sansforgetica, non-word, brease, non-seen, breakdous, Sure not seen, 2356","sansforgetica, non-word, headent, non-seen, hartilment, Sure not seen, 1770","sansforgetica, word, worth, seen, worth, Sure seen, 1923","sansforgetica, non-word, stich, seen, stich, Sure seen, 2010","sansforgetica, word, dropped, non-seen, driving, Probably not seen, 4192","sansforgetica, non-word, nignawary, non-seen, newspable, Sure seen, 3512","sansforgetica, non-word, sucling, seen, sucling, Sure seen, 2900","2333818","13-04-2019 04:59"
"yes","Non-designer","2","sansforgetica, word, methods, Sure word, 3202","sansforgetica, non-word, nontrantion, Probably non-word, 8358","sansforgetica, word, alive, Sure word, 2509","sansforgetica, word, often, Sure word, 1489","sansforgetica, non-word, pourse, Sure non-word, 2985","sansforgetica, non-word, uncessified, Sure non-word, 3632","sansforgetica, non-word, governmence, Probably non-word, 3758","sansforgetica, word, regarded, Sure word, 2641","sansforgetica, non-word, preeding, Sure word, 3235","sansforgetica, non-word, decommental, Sure non-word, 11462","sansforgetica, non-word, natimate, Sure non-word, 4420","sansforgetica, word, effect, Sure word, 3050","sansforgetica, word, walked, Sure word, 1999","sansforgetica, non-word, tealissed, Sure non-word, 3282","sansforgetica, word, named, Sure word, 2748","sansforgetica, word, twice, Sure word, 3875","sansforgetica, word, market, Sure word, 669","sansforgetica, word, therefore, Sure word, 8446","sansforgetica, non-word, obsentional, Sure non-word, 3631","sansforgetica, non-word, reasonatic, Probably word, 4464","50","ok","arial, word, effective, non-seen, effect, Probably seen, 5051","arial, non-word, goverpream, non-seen, governmence, Sure not seen, 2636","arial, word, walls, non-seen, walked, Sure not seen, 2224","arial, word, therefore, seen, therefore, Probably seen, 2699","arial, non-word, natimerable, non-seen, natimate, Probably not seen, 3403","arial, word, alive, seen, alive, Probably not seen, 2240","arial, word, names, non-seen, named, Sure not seen, 2154","arial, non-word, pourse, seen, pourse, Sure not seen, 1868","arial, word, methods, seen, methods, Sure seen, 3478","arial, word, market, seen, market, Probably not seen, 2213","arial, non-word, nontresnate, non-seen, nontrantion, Probably seen, 4307","arial, non-word, reasonatic, seen, reasonatic, Sure seen, 3306","arial, word, older, non-seen, often, Sure not seen, 2209","arial, non-word, occalution, non-seen, obsentional, Sure not seen, 3643","arial, non-word, tealissed, seen, tealissed, Sure seen, 3013","arial, non-word, uncessified, seen, uncessified, Sure seen, 2092","arial, word, theory, Sure word, 3231","arial, non-word, undimendent, Sure non-word, 3345","arial, word, north, Sure word, 1769","arial, word, level, Sure word, 1320","arial, non-word, glizagely, Probably non-word, 3843","arial, non-word, assolution, Probably word, 2800","arial, word, cannot, Probably non-word, 11895","arial, word, fight, Sure word, 7986","arial, non-word, impording, Probably non-word, 2144","arial, word, probably, Sure word, 1707","arial, non-word, durprology, Sure non-word, 2390","arial, non-word, occumeted, Probably non-word, 2711","arial, non-word, popubligals, Sure non-word, 2770","arial, non-word, slanding, Sure word, 2611","arial, word, waiting, Sure word, 2108","arial, word, military, Probably word, 2311","arial, word, smell, Sure word, 6532","arial, non-word, viried, Probably non-word, 3159","arial, non-word, utilograble, Sure non-word, 5069","arial, word, touch, Sure word, 2420","32","easy to read","sansforgetica, non-word, undividuals, non-seen, undimendent, Probably not seen, 5006","sansforgetica, non-word, utimunation, non-seen, utilograble, Probably not seen, 3022","sansforgetica, word, million, non-seen, military, Probably not seen, 3881","sansforgetica, non-word, impording, seen, impording, Probably not seen, 2734","sansforgetica, word, capable, non-seen, cannot, Probably not seen, 2481","sansforgetica, word, level, seen, level, Probably seen, 2382","sansforgetica, word, fight, seen, fight, Probably seen, 2956","sansforgetica, non-word, possecapped, non-seen, popubligals, Probably not seen, 3944","sansforgetica, non-word, slanding, seen, slanding, Sure seen, 3242","sansforgetica, non-word, visher, non-seen, viried, Probably not seen, 6191","sansforgetica, word, smiled, non-seen, smell, Sure not seen, 2397","sansforgetica, word, touch, seen, touch, Probably not seen, 2267","sansforgetica, word, theory, seen, theory, Probably not seen, 4422","sansforgetica, non-word, assolution, seen, assolution, Probably seen, 2403","sansforgetica, word, problems, non-seen, probably, Probably seen, 3588","sansforgetica, non-word, occumeted, seen, occumeted, Sure seen, 2045","2333617","13-04-2019 04:33"
"yes","Non-designer","2","sansforgetica, non-word, promoring, Probably non-word, 17528","sansforgetica, word, doors, Sure word, 2479","sansforgetica, word, similar, Sure word, 2114","sansforgetica, non-word, univerence, Sure non-word, 5236","sansforgetica, non-word, sacusaned, Probably non-word, 6063","sansforgetica, non-word, impreasive, Sure non-word, 6437","sansforgetica, word, master, Sure word, 2285","sansforgetica, non-word, ranned, Probably non-word, 4247","sansforgetica, word, relations, Sure word, 1838","sansforgetica, word, activities, Sure word, 3598","sansforgetica, word, saying, Sure word, 1446","sansforgetica, non-word, possiols, Probably non-word, 3918","sansforgetica, word, check, Sure word, 1433","sansforgetica, word, religious, Sure word, 1567","sansforgetica, word, behind, Sure word, 1269","sansforgetica, non-word, tramines, Probably word, 5613","sansforgetica, word, reduced, Sure word, 1317","sansforgetica, non-word, considenon, Sure non-word, 4284","sansforgetica, non-word, heroad, Probably non-word, 2401","sansforgetica, non-word, minalry, Probably word, 4671","50","difficult to read","arial, non-word, possiols, seen, possiols, Sure seen, 5242","arial, word, simply, non-seen, similar, Sure not seen, 4850","arial, word, relations, seen, relations, Sure seen, 1899","arial, non-word, ranned, seen, ranned, Sure seen, 1562","arial, word, scale, non-seen, saying, Probably not seen, 2123","arial, word, actual, non-seen, activities, Probably not seen, 1846","arial, non-word, sancerats, non-seen, sacusaned, Probably seen, 4173","arial, non-word, pronomail, non-seen, promoring, Sure seen, 2514","arial, word, check, seen, check, Sure not seen, 4181","arial, word, behind, seen, behind, Sure seen, 1640","arial, non-word, heroad, seen, heroad, Probably not seen, 4680","arial, non-word, considere, non-seen, considenon, Probably not seen, 2350","arial, non-word, tramines, seen, tramines, Sure seen, 1819","arial, non-word, impreit, non-seen, impreasive, Probably seen, 4280","arial, word, remain, non-seen, religious, Probably not seen, 3320","arial, word, reduced, seen, reduced, Sure seen, 4531","arial, word, technical, Sure word, 4353","arial, non-word, gream, Probably non-word, 3717","arial, word, charge, Sure word, 1249","arial, non-word, ourocrary, Sure word, 2151","arial, non-word, govelesses, Probably non-word, 10070","arial, word, company, Sure word, 1663","arial, non-word, impoining, Probably non-word, 2418","arial, word, built, Sure word, 1813","arial, word, wished, Sure word, 2051","arial, non-word, mothortere, Sure non-word, 2826","arial, non-word, afficled, Probably non-word, 2909","arial, word, included, Sure word, 1832","arial, word, couple, Sure word, 1183","arial, word, whose, Sure word, 1286","arial, non-word, excent, Probably non-word, 4417","arial, non-word, shannishes, Probably non-word, 5720","arial, non-word, incormately, Probably non-word, 1761","arial, non-word, lifented, Probably non-word, 1670","arial, word, holding, Sure word, 1600","arial, word, horses, Sure word, 1081","50","very easy to read","sansforgetica, non-word, goventunity, non-seen, govelesses, Sure not seen, 11161","sansforgetica, word, technical, seen, technical, Sure seen, 1598","sansforgetica, word, character, non-seen, charge, Sure not seen, 1686","sansforgetica, word, whose, seen, whose, Sure seen, 1865","sansforgetica, non-word, increasion, non-seen, incormately, Probably not seen, 4882","sansforgetica, non-word, ligher, non-seen, lifented, Sure not seen, 3200","sansforgetica, non-word, shannishes, seen, shannishes, Sure seen, 2286","sansforgetica, non-word, excent, seen, excent, Sure seen, 1250","sansforgetica, word, business, non-seen, built, Sure not seen, 1968","sansforgetica, word, holding, seen, holding, Probably not seen, 2816","sansforgetica, non-word, ourocrary, seen, ourocrary, Sure seen, 4666","sansforgetica, word, hospital, non-seen, horses, Sure not seen, 1786","sansforgetica, word, couple, seen, couple, Sure seen, 2926","sansforgetica, non-word, mothortere, seen, mothortere, Sure seen, 1788","sansforgetica, non-word, imporaters, non-seen, impoining, Probably not seen, 2669","sansforgetica, word, income, non-seen, included, Probably not seen, 1884","2333592","13-04-2019 04:30"
