"yes","Graphic designer","1","sansforgetica, non-word, lithin, Probably non-word, 11890","sansforgetica, non-word, puscest, Probably word, 7766","sansforgetica, non-word, fenis, Sure word, 4323","sansforgetica, non-word, freasional, Probably non-word, 7594","sansforgetica, word, country, Sure word, 2415","sansforgetica, non-word, stronous, Probably word, 3696","sansforgetica, non-word, eurviver, Probably word, 6291","sansforgetica, non-word, tersuact, Probably non-word, 7477","sansforgetica, non-word, rescributed, Sure non-word, 4999","sansforgetica, word, described, Sure word, 1902","sansforgetica, word, tonight, Sure word, 1756","sansforgetica, word, solution, Sure word, 1691","sansforgetica, word, terrible, Sure word, 1624","sansforgetica, word, afraid, Sure word, 1368","sansforgetica, word, narrow, Sure word, 1231","sansforgetica, word, relatively, Sure word, 1010","sansforgetica, word, discovered, Sure word, 1722","sansforgetica, non-word, couster, Probably non-word, 2865","sansforgetica, word, nodded, Sure word, 3019","sansforgetica, non-word, syster, Probably non-word, 4213","18","ok","sansforgetica, word, totally, non-seen, tonight, Sure seen, 5140","sansforgetica, non-word, stronous, seen, stronous, Sure seen, 2926","sansforgetica, non-word, evere, non-seen, eurviver, Sure seen, 5638","sansforgetica, non-word, rescributed, seen, rescributed, Probably seen, 2518","sansforgetica, non-word, littletely, non-seen, lithin, Probably seen, 2591","sansforgetica, non-word, frighboure, non-seen, freasional, Probably not seen, 2066","sansforgetica, word, discovered, seen, discovered, Sure seen, 2175","sansforgetica, word, solution, seen, solution, Sure seen, 1189","sansforgetica, non-word, fesituded, non-seen, fenis, Probably seen, 3110","sansforgetica, non-word, puscest, seen, puscest, Sure seen, 1593","sansforgetica, word, nation, non-seen, narrow, Sure seen, 1583","sansforgetica, word, terrible, seen, terrible, Sure seen, 1385","sansforgetica, word, noise, non-seen, nodded, Sure seen, 1396","sansforgetica, non-word, couster, seen, couster, Probably seen, 1884","sansforgetica, word, relief, non-seen, relatively, Sure seen, 1819","sansforgetica, word, country, seen, country, Sure seen, 1798","arial, word, school, Sure word, 3661","arial, non-word, unione, Probably non-word, 2090","arial, non-word, frafering, Probably non-word, 3435","arial, word, finished, Sure word, 1505","arial, non-word, hunwary, Probably word, 2275","arial, word, explained, Sure word, 1326","arial, non-word, doweract, Probably word, 2831","arial, non-word, dinded, Probably word, 3445","arial, non-word, olded, Probably non-word, 2645","arial, word, safety, Sure word, 1109","arial, word, steps, Sure word, 1264","arial, non-word, tunning, Probably word, 5915","arial, word, whose, Sure word, 1754","arial, word, third, Sure word, 1220","arial, non-word, remangth, Sure non-word, 3276","arial, word, books, Sure word, 1298","arial, non-word, separtly, Sure non-word, 2301","arial, word, shall, Sure word, 1167","arial, non-word, upties, Probably non-word, 3237","arial, word, store, Sure word, 1450","64","very easy to read","arial, word, books, seen, books, Sure seen, 2406","arial, word, window, non-seen, whose, Sure seen, 992","arial, non-word, unione, seen, unione, Sure seen, 2102","arial, word, store, seen, store, Sure seen, 1132","arial, non-word, drankes, non-seen, doweract, Sure seen, 1457","arial, non-word, frafering, seen, frafering, Sure seen, 884","arial, non-word, remangth, seen, remangth, Sure seen, 845","arial, word, schools, non-seen, school, Sure seen, 970","arial, word, first, non-seen, finished, Sure seen, 1631","arial, non-word, turpagance, non-seen, tunning, Sure seen, 1787","arial, word, safety, seen, safety, Sure seen, 1063","arial, word, explained, seen, explained, Sure seen, 1020","arial, non-word, hunwary, seen, hunwary, Sure seen, 2636","arial, non-word, sepernment, non-seen, separtly, Sure not seen, 2027","arial, word, shape, non-seen, shall, Sure not seen, 1680","arial, non-word, opergence, non-seen, olded, Sure not seen, 1202","2317131","11-04-2019 13:09"
"yes","Non-designer","1","sansforgetica, non-word, succerdly, Probably non-word, 6953","sansforgetica, word, proved, Sure word, 4226","sansforgetica, word, himself, Sure word, 3383","sansforgetica, word, slightly, Sure word, 3891","sansforgetica, word, dress, Sure word, 3417","sansforgetica, non-word, slanding, Probably non-word, 4881","sansforgetica, word, certainly, Sure word, 4047","sansforgetica, non-word, throure, Probably non-word, 6021","sansforgetica, non-word, curonoms, Probably non-word, 6319","sansforgetica, word, medical, Sure word, 3349","sansforgetica, word, doors, Sure word, 2724","sansforgetica, non-word, lovessions, Probably non-word, 4826","sansforgetica, word, scale, Sure word, 2283","sansforgetica, non-word, sancerats, Probably non-word, 4456","sansforgetica, non-word, memated, Probably non-word, 3189","sansforgetica, word, terrible, Sure word, 2070","sansforgetica, word, campaign, Sure word, 2960","sansforgetica, non-word, concessibly, Probably non-word, 3018","sansforgetica, non-word, milevate, Probably non-word, 3068","sansforgetica, non-word, conjunteful, Probably non-word, 4685","50","ok","sansforgetica, word, campaign, seen, campaign, Sure seen, 6933","sansforgetica, word, proved, seen, proved, Sure seen, 2494","sansforgetica, non-word, throure, seen, throure, Probably seen, 4120","sansforgetica, word, meeting, non-seen, medical, Probably not seen, 5908","sansforgetica, word, certainly, seen, certainly, Sure seen, 1869","sansforgetica, word, dressed, non-seen, dress, Probably seen, 4287","sansforgetica, non-word, calate, non-seen, curonoms, Probably not seen, 5422","sansforgetica, word, slightly, seen, slightly, Probably seen, 3067","sansforgetica, non-word, millars, non-seen, milevate, Sure not seen, 3516","sansforgetica, non-word, conclution, non-seen, concessibly, Probably not seen, 4239","sansforgetica, non-word, lovessions, seen, lovessions, Sure seen, 2568","sansforgetica, word, history, non-seen, himself, Probably not seen, 2820","sansforgetica, non-word, satched, non-seen, sancerats, Probably not seen, 4959","sansforgetica, non-word, conjunteful, seen, conjunteful, Sure seen, 3511","sansforgetica, non-word, slanding, seen, slanding, Sure seen, 2379","sansforgetica, word, scene, non-seen, scale, Probably not seen, 2863","arial, word, shoulder, Sure word, 3454","arial, word, deeply, Sure word, 1567","arial, word, married, Sure word, 1450","arial, non-word, miscuity, Probably non-word, 4290","arial, word, count, Sure word, 4285","arial, non-word, orgument, Probably non-word, 3806","arial, non-word, sprikelf, Probably non-word, 3117","arial, non-word, villies, Probably non-word, 2483","arial, word, short, Sure word, 1816","arial, word, meant, Sure word, 1435","arial, non-word, acadence, Probably non-word, 3355","arial, non-word, especiling, Probably non-word, 2463","arial, word, cigarette, Sure word, 2008","arial, word, alone, Sure word, 1642","arial, word, build, Sure word, 1442","arial, non-word, explaign, Probably non-word, 2899","arial, non-word, infegatione, Probably non-word, 3281","arial, non-word, tommon, Probably non-word, 2455","arial, word, escape, Sure word, 1728","arial, non-word, goverpream, Probably non-word, 2717","50","very easy to read","arial, non-word, acadence, seen, acadence, Probably seen, 8538","arial, word, building, non-seen, build, Sure seen, 1601","arial, non-word, infortition, non-seen, infegatione, Probably not seen, 2405","arial, non-word, tommon, seen, tommon, Sure seen, 1955","arial, word, means, non-seen, meant, Probably not seen, 2198","arial, non-word, miscuity, seen, miscuity, Sure seen, 1710","arial, word, escape, seen, escape, Sure seen, 1611","arial, word, country, non-seen, count, Sure not seen, 4480","arial, word, shoulder, seen, shoulder, Sure seen, 1912","arial, word, short, seen, short, Sure seen, 1570","arial, word, cities, non-seen, cigarette, Sure not seen, 2108","arial, non-word, espernence, non-seen, especiling, Probably seen, 3341","arial, non-word, explaign, seen, explaign, Sure seen, 2127","arial, non-word, gradboate, non-seen, goverpream, Sure not seen, 4562","arial, non-word, orienuation, non-seen, orgument, Probably not seen, 6929","arial, word, married, seen, married, Sure seen, 1752","2316802","11-04-2019 12:28"
"yes","Graphic designer","1","arial, word, parts, Sure word, 1592","arial, word, beauty, Sure word, 1747","arial, non-word, natheracing, Probably non-word, 3238","arial, word, exist, Sure word, 1792","arial, non-word, hopulatute, Probably non-word, 2927","arial, non-word, midonious, Probably non-word, 4249","arial, non-word, outting, Sure non-word, 3569","arial, word, argument, Sure word, 3169","arial, word, companies, Sure word, 1558","arial, non-word, reaptality, Sure non-word, 3279","arial, word, according, Sure word, 2135","arial, non-word, pericer, Probably non-word, 3690","arial, non-word, sungs, Probably non-word, 2055","arial, word, interesting, Sure word, 1648","arial, word, dangerous, Sure word, 1240","arial, word, argued, Sure word, 1225","arial, non-word, windom, Probably non-word, 2807","arial, word, closer, Sure word, 1384","arial, non-word, althdren, Probably non-word, 3425","arial, non-word, folitties, Probably non-word, 2392","68","very easy to read","arial, word, around, non-seen, argument, Probably seen, 6591","arial, word, closer, seen, closer, Sure seen, 4384","arial, non-word, milently, non-seen, midonious, Sure not seen, 3504","arial, non-word, natimate, non-seen, natheracing, Probably seen, 3617","arial, non-word, pericer, seen, pericer, Sure seen, 2481","arial, non-word, reart, non-seen, reaptality, Probably not seen, 3286","arial, non-word, outting, seen, outting, Sure seen, 2416","arial, word, argued, seen, argued, Sure seen, 1288","arial, non-word, horeations, non-seen, hopulatute, Sure not seen, 3128","arial, non-word, folitties, seen, folitties, Sure seen, 2025","arial, word, dangerous, seen, dangerous, Sure seen, 1406","arial, word, became, non-seen, beauty, Probably not seen, 2448","arial, word, according, seen, according, Sure seen, 1465","arial, non-word, althdren, seen, althdren, Sure seen, 1624","arial, word, passing, non-seen, parts, Probably seen, 4368","arial, word, introduced, non-seen, interesting, Sure seen, 3288","sansforgetica, non-word, flueement, Probably non-word, 4784","sansforgetica, word, considered, Sure word, 1640","sansforgetica, word, thousands, Sure word, 1423","sansforgetica, word, production, Sure word, 1393","sansforgetica, non-word, prosequents, Probably non-word, 2451","sansforgetica, non-word, dearn, Probably non-word, 3300","sansforgetica, word, sector, Sure word, 1457","sansforgetica, non-word, espeatives, Probably non-word, 5016","sansforgetica, word, tired, Sure word, 1384","sansforgetica, word, service, Sure word, 1312","sansforgetica, word, together, Sure word, 1144","sansforgetica, word, desire, Sure word, 1023","sansforgetica, non-word, untin, Probably non-word, 2392","sansforgetica, non-word, exectorial, Probably non-word, 2984","sansforgetica, non-word, persondants, Probably non-word, 2649","sansforgetica, non-word, peoped, Probably non-word, 3631","sansforgetica, non-word, girayed, Probably non-word, 1592","sansforgetica, non-word, shannishes, Probably non-word, 3818","sansforgetica, word, series, Sure word, 1958","sansforgetica, word, formed, Sure word, 1160","70","ok","sansforgetica, word, contact, non-seen, considered, Probably not seen, 4930","sansforgetica, word, production, seen, production, Sure seen, 2549","sansforgetica, non-word, unwiliate, non-seen, untin, Sure not seen, 2986","sansforgetica, word, setting, non-seen, service, Probably seen, 1718","sansforgetica, word, tired, seen, tired, Sure seen, 1290","sansforgetica, non-word, dearn, seen, dearn, Sure seen, 1406","sansforgetica, word, seriously, non-seen, series, Sure seen, 1160","sansforgetica, non-word, shass, non-seen, shannishes, Sure not seen, 2681","sansforgetica, non-word, persondants, seen, persondants, Sure seen, 2008","sansforgetica, non-word, espeatives, seen, espeatives, Sure seen, 2129","sansforgetica, word, thousands, seen, thousands, Sure seen, 1174","sansforgetica, word, former, non-seen, formed, Probably not seen, 3088","sansforgetica, non-word, girst, non-seen, girayed, Sure not seen, 2145","sansforgetica, non-word, foilly, non-seen, flueement, Sure not seen, 1415","sansforgetica, word, desire, seen, desire, Sure seen, 1265","sansforgetica, non-word, exectorial, seen, exectorial, Sure seen, 1312","2316661","11-04-2019 12:12"
"yes","Non-designer","1","arial, word, together, Sure word, 2128","arial, word, contact, Sure word, 1871","arial, non-word, minned, Probably non-word, 2760","arial, word, painting, Sure word, 2350","arial, non-word, lunnest, Probably non-word, 2803","arial, non-word, thiles, Probably non-word, 3556","arial, non-word, brisis, Probably non-word, 5041","arial, word, older, Sure word, 2270","arial, word, spread, Sure word, 4089","arial, word, managed, Sure word, 1697","arial, non-word, narnisite, Probably non-word, 4788","arial, word, organized, Sure word, 2055","arial, non-word, mocietary, Probably non-word, 3333","arial, non-word, convence, Probably non-word, 8581","arial, non-word, exectorial, Probably word, 6800","arial, non-word, lodieves, Probably non-word, 2559","arial, word, store, Sure word, 1824","arial, word, normal, Sure word, 2374","arial, word, opening, Sure word, 1820","arial, non-word, drankes, Probably non-word, 2820","92","very easy to read","arial, word, together, seen, together, Sure seen, 3387","arial, word, operations, non-seen, opening, Sure not seen, 2814","arial, word, managed, seen, managed, Sure seen, 2100","arial, non-word, mocietary, seen, mocietary, Sure seen, 2953","arial, non-word, conventment, non-seen, convence, Sure not seen, 3167","arial, non-word, lunnest, seen, lunnest, Sure seen, 2236","arial, word, opened, non-seen, older, Sure not seen, 5030","arial, non-word, lodieves, seen, lodieves, Sure seen, 4863","arial, non-word, narnisite, seen, narnisite, Sure seen, 2442","arial, word, store, seen, store, Sure not seen, 3686","arial, non-word, minsuit, non-seen, minned, Sure not seen, 2356","arial, non-word, brives, non-seen, brisis, Sure not seen, 2316","arial, non-word, dreentic, non-seen, drankes, Sure not seen, 1838","arial, word, spread, seen, spread, Sure not seen, 2322","arial, word, original, non-seen, organized, Sure seen, 2407","arial, word, content, non-seen, contact, Sure not seen, 2090","sansforgetica, non-word, reating, Probably non-word, 6844","sansforgetica, word, department, Sure word, 1999","sansforgetica, word, otherwise, Sure word, 2447","sansforgetica, non-word, hapording, Probably non-word, 3191","sansforgetica, non-word, nommidated, Probably non-word, 4714","sansforgetica, word, support, Sure word, 2165","sansforgetica, word, sight, Sure word, 1741","sansforgetica, word, build, Sure word, 1840","sansforgetica, word, feels, Sure word, 2448","sansforgetica, non-word, plactarshed, Sure non-word, 5986","sansforgetica, non-word, schieverily, Sure non-word, 2653","sansforgetica, word, style, Sure word, 2062","sansforgetica, non-word, masuld, Sure non-word, 2423","sansforgetica, non-word, considenon, Sure non-word, 5256","sansforgetica, word, religious, Sure word, 2010","sansforgetica, word, increasing, Sure word, 2167","sansforgetica, word, imagine, Sure word, 1933","sansforgetica, non-word, fighly, Sure non-word, 2953","sansforgetica, non-word, morward, Sure non-word, 5925","sansforgetica, non-word, autteuvrity, Sure non-word, 2545","89","difficult to read","sansforgetica, non-word, autteuvrity, seen, autteuvrity, Sure not seen, 2611","sansforgetica, word, remain, non-seen, religious, Probably not seen, 8072","sansforgetica, word, ought, non-seen, otherwise, Sure not seen, 2328","sansforgetica, non-word, nontrantion, non-seen, nommidated, Sure not seen, 2707","sansforgetica, non-word, matisiber, non-seen, masuld, Sure not seen, 1998","sansforgetica, word, fellow, non-seen, feels, Sure not seen, 2288","sansforgetica, non-word, happered, non-seen, hapording, Sure not seen, 2576","sansforgetica, word, imagine, seen, imagine, Sure seen, 2051","sansforgetica, word, increasing, seen, increasing, Sure seen, 2313","sansforgetica, non-word, reating, seen, reating, Sure seen, 4430","sansforgetica, word, supposed, non-seen, support, Sure not seen, 2611","sansforgetica, word, department, seen, department, Sure seen, 2333","sansforgetica, non-word, moster, non-seen, morward, Sure not seen, 2763","sansforgetica, non-word, considenon, seen, considenon, Sure seen, 2652","sansforgetica, word, sight, seen, sight, Sure seen, 2059","sansforgetica, non-word, plactarshed, seen, plactarshed, Sure seen, 2188","2314796","11-04-2019 08:33"
"yes","Graphic designer","1","sansforgetica, non-word, romoting, Probably non-word, 5490","sansforgetica, non-word, disartanter, Probably non-word, 2903","sansforgetica, non-word, goverpream, Sure non-word, 3431","sansforgetica, non-word, dissehons, Probably non-word, 8281","sansforgetica, word, hands, Sure word, 3151","sansforgetica, non-word, occumeted, Probably word, 2744","sansforgetica, word, bring, Sure word, 1474","sansforgetica, word, fifty, Sure word, 1215","sansforgetica, word, called, Sure word, 1171","sansforgetica, non-word, surcenters, Probably word, 3925","sansforgetica, word, daughter, Sure word, 1890","sansforgetica, word, cause, Sure word, 1069","sansforgetica, word, learning, Sure word, 1102","sansforgetica, non-word, excent, Sure word, 2609","sansforgetica, non-word, rould, Probably word, 3319","sansforgetica, non-word, refectuning, Probably word, 3984","sansforgetica, non-word, impording, Probably non-word, 2982","sansforgetica, word, advice, Sure word, 1405","sansforgetica, word, playing, Sure word, 1383","sansforgetica, word, spread, Sure word, 1521","65","ok","sansforgetica, word, affairs, non-seen, advice, Sure not seen, 6234","sansforgetica, word, calling, non-seen, called, Probably seen, 2440","sansforgetica, non-word, romoting, seen, romoting, Probably seen, 4017","sansforgetica, word, bring, seen, bring, Sure seen, 1249","sansforgetica, non-word, rountes, non-seen, rould, Sure seen, 1790","sansforgetica, non-word, suronder, non-seen, surcenters, Sure not seen, 3902","sansforgetica, non-word, disartanter, seen, disartanter, Probably seen, 3262","sansforgetica, word, happened, non-seen, hands, Sure not seen, 1789","sansforgetica, non-word, occumeted, seen, occumeted, Sure seen, 2059","sansforgetica, non-word, gradboate, non-seen, goverpream, Probably not seen, 4512","sansforgetica, word, cause, seen, cause, Sure seen, 1506","sansforgetica, word, daughter, seen, daughter, Sure seen, 980","sansforgetica, non-word, refectuning, seen, refectuning, Sure seen, 2115","sansforgetica, word, spring, non-seen, spread, Sure not seen, 1913","sansforgetica, word, playing, seen, playing, Sure seen, 2295","sansforgetica, non-word, impreasive, non-seen, impording, Probably not seen, 1947","arial, word, might, Sure word, 4713","arial, word, pattern, Sure word, 1014","arial, word, position, Sure word, 1147","arial, non-word, towever, Probably word, 2779","arial, word, becoming, Sure word, 1485","arial, non-word, speciah, Sure non-word, 3216","arial, non-word, meade, Sure word, 1633","arial, non-word, momorned, Sure non-word, 3061","arial, word, charge, Sure word, 1248","arial, non-word, miney, Probably word, 1721","arial, word, property, Sure word, 1360","arial, non-word, conscioning, Probably non-word, 2375","arial, non-word, schoon, Probably non-word, 1957","arial, word, needed, Sure word, 1261","arial, word, occasion, Sure word, 1428","arial, non-word, histemence, Probably word, 2384","arial, word, cannot, Sure word, 1295","arial, word, found, Sure word, 821","arial, non-word, catuirented, Probably non-word, 3984","arial, non-word, natender, Probably non-word, 1484","70","very easy to read","arial, word, peace, non-seen, pattern, Sure not seen, 2373","arial, non-word, natender, seen, natender, Sure seen, 1743","arial, non-word, specination, non-seen, speciah, Probably seen, 1870","arial, word, cannot, seen, cannot, Sure seen, 1169","arial, word, bedroom, non-seen, becoming, Sure not seen, 1743","arial, non-word, meade, seen, meade, Sure seen, 1350","arial, non-word, momorned, seen, momorned, Sure seen, 1373","arial, non-word, catuirented, seen, catuirented, Sure seen, 1046","arial, word, miles, non-seen, might, Sure not seen, 1396","arial, word, position, seen, position, Sure not seen, 1507","arial, non-word, consicular, non-seen, conscioning, Sure not seen, 2081","arial, word, occurred, non-seen, occasion, Sure not seen, 1564","arial, non-word, mingerned, non-seen, miney, Sure not seen, 2003","arial, word, charge, seen, charge, Sure seen, 1316","arial, non-word, scientable, non-seen, schoon, Sure not seen, 1306","arial, word, needed, seen, needed, Sure seen, 2034","2314576","11-04-2019 08:12"
"yes","Non-designer","1","sansforgetica, word, soldiers, Sure word, 2585","sansforgetica, word, wealth, Sure word, 1223","sansforgetica, word, playing, Sure word, 1320","sansforgetica, word, project, Sure word, 1152","sansforgetica, non-word, applictable, Sure non-word, 4040","sansforgetica, non-word, beausance, Sure non-word, 4808","sansforgetica, non-word, fraditted, Sure non-word, 2472","sansforgetica, word, almost, Sure word, 2175","sansforgetica, non-word, intersive, Sure non-word, 5904","sansforgetica, word, police, Sure word, 2201","sansforgetica, non-word, curonoms, Probably non-word, 5433","sansforgetica, non-word, accation, Probably non-word, 2464","sansforgetica, word, across, Sure word, 2215","sansforgetica, word, guilty, Sure word, 1441","sansforgetica, word, given, Sure word, 1135","sansforgetica, word, generally, Sure word, 2353","sansforgetica, non-word, exerional, Sure non-word, 4321","sansforgetica, non-word, taked, Sure non-word, 2437","sansforgetica, non-word, unformately, Sure non-word, 4480","sansforgetica, non-word, violetic, Sure non-word, 2448","50","ok","sansforgetica, non-word, frafering, non-seen, fraditted, Sure not seen, 8384","sansforgetica, word, solution, non-seen, soldiers, Sure not seen, 1904","sansforgetica, word, pleased, non-seen, playing, Sure not seen, 1871","sansforgetica, non-word, accephysive, non-seen, accation, Sure not seen, 2232","sansforgetica, non-word, beausance, seen, beausance, Sure seen, 2391","sansforgetica, word, policies, non-seen, police, Probably not seen, 7737","sansforgetica, non-word, viried, non-seen, violetic, Probably not seen, 6329","sansforgetica, word, generation, non-seen, generally, Sure not seen, 2358","sansforgetica, word, given, seen, given, Sure not seen, 2576","sansforgetica, non-word, exerional, seen, exerional, Sure seen, 2585","sansforgetica, non-word, calate, non-seen, curonoms, Probably not seen, 3103","sansforgetica, non-word, applictable, seen, applictable, Probably seen, 2841","sansforgetica, word, wealth, seen, wealth, Sure seen, 1864","sansforgetica, word, guilty, seen, guilty, Sure seen, 999","sansforgetica, word, almost, seen, almost, Sure seen, 1098","sansforgetica, non-word, taked, seen, taked, Sure seen, 1680","arial, non-word, underation, Sure non-word, 3552","arial, word, respect, Sure word, 1712","arial, word, school, Sure word, 1488","arial, non-word, beckeys, Probably non-word, 3252","arial, non-word, brisis, Probably non-word, 6494","arial, word, operations, Sure word, 1760","arial, word, spoke, Sure word, 1342","arial, word, college, Sure word, 1152","arial, word, colonel, Sure word, 1617","arial, non-word, comehol, Sure non-word, 3103","arial, non-word, amonged, Sure non-word, 2129","arial, word, opening, Sure word, 1824","arial, word, local, Sure word, 2727","arial, non-word, depernment, Sure non-word, 3297","arial, word, alive, Sure word, 1791","arial, word, comes, Sure word, 2169","arial, non-word, gathdrent, Probably non-word, 2119","arial, non-word, prohialized, Probably non-word, 3753","arial, non-word, aponoments, Sure non-word, 2447","arial, non-word, goventunity, Sure non-word, 1553","50","very easy to read","arial, word, college, seen, college, Sure seen, 3335","arial, word, spread, non-seen, spoke, Probably seen, 1632","arial, non-word, depernment, seen, depernment, Probably seen, 2336","arial, non-word, amonged, seen, amonged, Sure seen, 1752","arial, word, longer, non-seen, local, Sure not seen, 1832","arial, word, alive, seen, alive, Sure not seen, 1403","arial, non-word, gatimasher, non-seen, gathdrent, Sure not seen, 1477","arial, word, opinion, non-seen, operations, Sure not seen, 1504","arial, non-word, brisis, seen, brisis, Sure seen, 1936","arial, word, response, non-seen, respect, Probably not seen, 2088","arial, non-word, becret, non-seen, beckeys, Sure not seen, 2632","arial, non-word, promatic, non-seen, prohialized, Sure not seen, 1864","arial, word, school, seen, school, Sure seen, 1432","arial, non-word, comempted, non-seen, comehol, Probably seen, 2409","arial, non-word, goventunity, seen, goventunity, Sure seen, 1871","arial, word, comes, seen, comes, Sure seen, 1129","2309898","10-04-2019 21:00"
