"yes","Letter designer","1","arial, word, covered, Sure word, 4834","arial, non-word, countenth, Sure non-word, 6249","arial, non-word, revernment, Probably non-word, 3216","arial, word, thick, Sure word, 1583","arial, non-word, masuld, Sure non-word, 2058","arial, word, welfare, Probably word, 3155","arial, word, carry, Sure word, 1835","arial, word, compared, Sure word, 1131","arial, non-word, larms, Probably non-word, 2282","arial, word, attitude, Sure word, 1871","arial, non-word, cerving, Probably non-word, 5066","arial, non-word, ordiever, Probably non-word, 4419","arial, non-word, adolormated, Probably non-word, 3707","arial, word, clean, Sure word, 1492","arial, non-word, papid, Probably non-word, 2843","arial, word, sudden, Sure word, 1699","arial, non-word, woung, Probably non-word, 2879","arial, non-word, mandon, Probably non-word, 4070","arial, word, thinking, Sure word, 1360","arial, word, forget, Sure word, 1291","40","very easy to read","arial, word, forget, seen, forget, Probably seen, 11074","arial, non-word, counticks, non-seen, countenth, Sure not seen, 2219","arial, word, sudden, seen, sudden, Sure seen, 1491","arial, word, carry, seen, carry, Sure seen, 1190","arial, non-word, advanth, non-seen, adolormated, Probably seen, 2731","arial, word, clear, non-seen, clean, Probably not seen, 4382","arial, non-word, orgument, non-seen, ordiever, Sure not seen, 1631","arial, non-word, larms, seen, larms, Sure seen, 1810","arial, non-word, revernment, seen, revernment, Sure seen, 1630","arial, word, western, non-seen, welfare, Sure not seen, 1786","arial, word, compared, seen, compared, Probably seen, 2337","arial, word, thing, non-seen, thick, Sure seen, 1739","arial, non-word, mandon, seen, mandon, Sure seen, 1278","arial, word, third, non-seen, thinking, Sure not seen, 1869","arial, non-word, wourt, non-seen, woung, Probably not seen, 2660","arial, non-word, masuld, seen, masuld, Probably not seen, 2143","sansforgetica, word, argued, Probably word, 10411","sansforgetica, word, worth, Sure word, 1720","sansforgetica, non-word, augary, Probably non-word, 5148","sansforgetica, non-word, opperal, Probably non-word, 1841","sansforgetica, word, holding, Sure word, 3066","sansforgetica, non-word, wassia, Sure non-word, 3787","sansforgetica, non-word, altional, Probably non-word, 2156","sansforgetica, non-word, shannishes, Probably non-word, 2995","sansforgetica, word, morning, Sure word, 1689","sansforgetica, word, sorry, Sure word, 1373","sansforgetica, non-word, motter, Probably non-word, 5173","sansforgetica, non-word, necressor, Probably non-word, 2211","sansforgetica, word, human, Sure word, 1467","sansforgetica, word, communist, Sure word, 1342","sansforgetica, non-word, grened, Probably non-word, 3139","sansforgetica, non-word, guatiammer, Probably non-word, 3272","sansforgetica, word, character, Sure word, 1333","sansforgetica, non-word, mealth, Probably non-word, 2797","sansforgetica, word, along, Sure word, 1349","sansforgetica, word, start, Sure word, 1076","34","difficult to read","sansforgetica, word, worth, seen, worth, Sure seen, 2031","sansforgetica, non-word, meanspheted, non-seen, mealth, Probably not seen, 2353","sansforgetica, word, argument, non-seen, argued, Probably not seen, 2091","sansforgetica, non-word, authorantal, non-seen, augary, Sure not seen, 2361","sansforgetica, non-word, oppers, non-seen, opperal, Sure not seen, 1779","sansforgetica, word, morning, seen, morning, Probably seen, 2110","sansforgetica, non-word, altional, seen, altional, Sure seen, 2030","sansforgetica, non-word, shannishes, seen, shannishes, Probably seen, 2017","sansforgetica, word, statement, non-seen, start, Sure not seen, 2210","sansforgetica, word, holding, seen, holding, Probably not seen, 1588","sansforgetica, non-word, guatiammer, seen, guatiammer, Probably seen, 3867","sansforgetica, word, character, seen, character, Sure seen, 1471","sansforgetica, word, already, non-seen, along, Probably not seen, 2236","sansforgetica, non-word, wassia, seen, wassia, Sure seen, 1648","sansforgetica, word, sounds, non-seen, sorry, Probably not seen, 4660","sansforgetica, non-word, neeld, non-seen, necressor, Sure not seen, 1948","2323844","12-04-2019 06:47"
"yes","Non-designer","1","sansforgetica, word, guilty, Sure word, 2587","sansforgetica, word, battle, Sure word, 2127","sansforgetica, word, performance, Sure word, 1373","sansforgetica, non-word, opperal, Probably non-word, 3450","sansforgetica, non-word, envolase, Sure non-word, 3376","sansforgetica, word, names, Sure word, 1761","sansforgetica, non-word, mering, Sure non-word, 2597","sansforgetica, non-word, riddly, Sure word, 2563","sansforgetica, non-word, temarrences, Sure non-word, 5848","sansforgetica, non-word, romoting, Sure non-word, 3330","sansforgetica, non-word, chares, Probably non-word, 2980","sansforgetica, word, season, Sure word, 2143","sansforgetica, word, claim, Sure word, 1807","sansforgetica, non-word, rutogement, Probably non-word, 2647","sansforgetica, word, walls, Sure word, 1812","sansforgetica, non-word, tealissed, Probably non-word, 2084","sansforgetica, word, calling, Sure word, 1386","sansforgetica, word, minute, Sure word, 1729","sansforgetica, non-word, forwared, Sure word, 1088","sansforgetica, word, politics, Sure word, 1387","38","ok","sansforgetica, non-word, teliquely, non-seen, tealissed, Sure not seen, 3969","sansforgetica, non-word, tempriation, non-seen, temarrences, Probably not seen, 2896","sansforgetica, word, games, non-seen, guilty, Probably not seen, 3119","sansforgetica, word, wanted, non-seen, walls, Probably not seen, 1657","sansforgetica, non-word, mering, seen, mering, Sure seen, 1763","sansforgetica, word, minute, seen, minute, Sure seen, 1354","sansforgetica, word, claim, seen, claim, Sure seen, 1222","sansforgetica, word, popular, non-seen, politics, Probably not seen, 2049","sansforgetica, word, names, seen, names, Sure seen, 1654","sansforgetica, non-word, chason, non-seen, chares, Probably not seen, 2617","sansforgetica, word, battle, seen, battle, Sure seen, 1557","sansforgetica, non-word, rutongance, non-seen, rutogement, Probably seen, 2249","sansforgetica, non-word, riddly, seen, riddly, Sure seen, 2651","sansforgetica, non-word, romoting, seen, romoting, Sure seen, 1576","sansforgetica, non-word, envolase, seen, envolase, Sure seen, 1787","sansforgetica, word, calls, non-seen, calling, Probably not seen, 3172","arial, non-word, unformately, Sure non-word, 4786","arial, word, brown, Sure word, 2151","arial, non-word, enoups, Sure non-word, 2355","arial, word, getting, Sure word, 5817","arial, word, british, Sure word, 1378","arial, non-word, differsive, Probably non-word, 2249","arial, non-word, pritain, Probably non-word, 3708","arial, word, north, Sure word, 2203","arial, non-word, mandon, Probably non-word, 2224","arial, non-word, rountes, Probably non-word, 1601","arial, non-word, allond, Probably non-word, 1399","arial, non-word, prosequents, Probably non-word, 2733","arial, non-word, nords, Probably non-word, 1968","arial, word, happy, Sure word, 1649","arial, word, original, Sure word, 1471","arial, word, clothes, Sure word, 955","arial, word, royal, Sure word, 1540","arial, word, impossible, Sure word, 1223","arial, word, process, Sure word, 1473","arial, non-word, macking, Probably non-word, 2160","55","very easy to read","arial, non-word, unfortiated, non-seen, unformately, Probably not seen, 2318","arial, word, production, non-seen, process, Probably not seen, 2678","arial, non-word, mandon, seen, mandon, Sure seen, 1935","arial, non-word, prospries, non-seen, prosequents, Probably not seen, 3683","arial, non-word, macking, seen, macking, Sure seen, 2497","arial, word, others, non-seen, original, Probably not seen, 1643","arial, word, brown, seen, brown, Sure seen, 1924","arial, non-word, rublic, non-seen, rountes, Probably not seen, 1626","arial, word, hardly, non-seen, happy, Probably not seen, 1833","arial, word, coffee, non-seen, clothes, Probably not seen, 1325","arial, non-word, differsive, seen, differsive, Probably seen, 2349","arial, non-word, pritain, seen, pritain, Sure seen, 1464","arial, non-word, norectly, non-seen, nords, Probably not seen, 2037","arial, word, royal, seen, royal, Sure seen, 1641","arial, word, north, seen, north, Sure seen, 1231","arial, word, british, seen, british, Sure seen, 1167","2323304","12-04-2019 05:45"
"yes","Non-designer","1","arial, non-word, incriance, Probably non-word, 12095","arial, non-word, suggers, Probably non-word, 7668","arial, word, nature, Sure word, 1878","arial, non-word, congressary, Sure word, 3968","arial, non-word, larms, Probably non-word, 3101","arial, non-word, narnisite, Probably word, 4622","arial, non-word, impording, Probably word, 2129","arial, word, majority, Sure word, 1629","arial, non-word, gream, Probably word, 2887","arial, non-word, sechniall, Probably non-word, 8071","arial, word, provide, Sure word, 1526","arial, word, gently, Sure word, 1249","arial, word, summer, Sure word, 1250","arial, non-word, beight, Probably non-word, 4426","arial, word, stars, Sure word, 1209","arial, word, waiting, Sure word, 1114","arial, non-word, intervating, Sure word, 2522","arial, word, either, Sure word, 1420","arial, word, reported, Sure word, 1479","arial, word, those, Sure word, 1335","77","very easy to read","arial, non-word, inderected, non-seen, incriance, Sure not seen, 5820","arial, word, gently, seen, gently, Sure seen, 1897","arial, word, election, non-seen, either, Sure not seen, 2287","arial, word, though, non-seen, those, Sure not seen, 1916","arial, word, reported, seen, reported, Sure seen, 1848","arial, non-word, beight, seen, beight, Sure seen, 2500","arial, word, majority, seen, majority, Sure seen, 1831","arial, non-word, natcher, non-seen, narnisite, Sure not seen, 2486","arial, word, supply, non-seen, summer, Sure seen, 3501","arial, word, stars, seen, stars, Sure seen, 3513","arial, non-word, inverstand, non-seen, intervating, Probably not seen, 5853","arial, non-word, gream, seen, gream, Sure seen, 1744","arial, non-word, suggers, seen, suggers, Sure seen, 1806","arial, non-word, congressary, seen, congressary, Sure seen, 1750","arial, non-word, impreasive, non-seen, impording, Sure not seen, 5834","arial, word, walked, non-seen, waiting, Sure not seen, 1816","sansforgetica, non-word, tealissed, Probably non-word, 15427","sansforgetica, word, audience, Sure word, 1962","sansforgetica, non-word, unfortiated, Probably word, 4614","sansforgetica, word, eight, Sure word, 1802","sansforgetica, non-word, lunds, Probably non-word, 2801","sansforgetica, non-word, mutomphers, Probably non-word, 7152","sansforgetica, word, reached, Sure word, 1459","sansforgetica, word, explained, Sure word, 1636","sansforgetica, non-word, littor, Probably non-word, 5198","sansforgetica, non-word, anotter, Sure non-word, 5452","sansforgetica, word, similar, Sure word, 2754","sansforgetica, word, general, Sure word, 1483","sansforgetica, word, ended, Sure word, 1433","sansforgetica, non-word, compaing, Probably non-word, 6751","sansforgetica, word, prices, Sure word, 1510","sansforgetica, non-word, matitary, Probably non-word, 8928","sansforgetica, word, offered, Sure word, 1325","sansforgetica, non-word, driftion, Probably non-word, 3636","sansforgetica, non-word, recrophouts, Probably word, 6799","sansforgetica, word, proportion, Sure word, 2375","82","ok","sansforgetica, non-word, rectined, non-seen, recrophouts, Probably not seen, 4549","sansforgetica, word, eight, seen, eight, Sure seen, 1684","sansforgetica, non-word, comparation, non-seen, compaing, Sure seen, 2838","sansforgetica, non-word, tealissed, seen, tealissed, Sure seen, 2233","sansforgetica, word, reached, seen, reached, Sure seen, 1882","sansforgetica, word, office, non-seen, offered, Sure not seen, 2317","sansforgetica, word, generally, non-seen, general, Sure not seen, 2595","sansforgetica, non-word, lunnest, non-seen, lunds, Sure not seen, 2352","sansforgetica, word, proportion, seen, proportion, Sure seen, 1937","sansforgetica, word, explained, seen, explained, Sure seen, 1929","sansforgetica, non-word, mutomphers, seen, mutomphers, Sure seen, 2034","sansforgetica, word, prime, non-seen, prices, Sure not seen, 2429","sansforgetica, non-word, unfortiated, seen, unfortiated, Probably seen, 2907","sansforgetica, word, enemy, non-seen, ended, Sure not seen, 2831","sansforgetica, non-word, matitary, seen, matitary, Sure seen, 2116","sansforgetica, non-word, lodieves, non-seen, littor, Sure not seen, 2985","2322361","12-04-2019 03:38"
"yes","Non-designer","1","sansforgetica, word, listen, Sure word, 5324","sansforgetica, word, hours, Sure word, 2506","sansforgetica, word, sector, Sure word, 1657","sansforgetica, word, division, Sure word, 1625","sansforgetica, word, accident, Sure word, 1663","sansforgetica, word, similar, Sure word, 2076","sansforgetica, non-word, simplete, Probably non-word, 4121","sansforgetica, non-word, surcenters, Probably non-word, 4406","sansforgetica, non-word, absturable, Sure non-word, 2548","sansforgetica, word, treatment, Sure word, 3247","sansforgetica, word, statement, Sure word, 1846","sansforgetica, non-word, continated, Sure non-word, 3490","sansforgetica, word, servants, Sure word, 3256","sansforgetica, non-word, decky, Probably non-word, 4092","sansforgetica, non-word, undublisted, Sure non-word, 3002","sansforgetica, non-word, lithin, Probably non-word, 2652","sansforgetica, non-word, dearn, Sure non-word, 4698","sansforgetica, word, admit, Sure word, 1884","sansforgetica, non-word, darrity, Probably non-word, 2850","sansforgetica, non-word, shass, Sure non-word, 1906","71","difficult to read","sansforgetica, non-word, acadence, non-seen, absturable, Sure not seen, 3479","sansforgetica, word, division, seen, division, Sure seen, 2233","sansforgetica, word, security, non-seen, sector, Sure not seen, 1988","sansforgetica, non-word, dechnology, non-seen, dearn, Sure not seen, 1694","sansforgetica, word, adult, non-seen, admit, Sure not seen, 2543","sansforgetica, word, hours, seen, hours, Sure seen, 1703","sansforgetica, word, listen, seen, listen, Sure seen, 1483","sansforgetica, non-word, littletely, non-seen, lithin, Sure not seen, 1678","sansforgetica, non-word, simplete, seen, simplete, Sure seen, 1839","sansforgetica, non-word, darrity, seen, darrity, Sure seen, 1605","sansforgetica, word, treatment, seen, treatment, Sure seen, 1299","sansforgetica, word, served, non-seen, servants, Sure not seen, 1850","sansforgetica, non-word, suronder, non-seen, surcenters, Sure not seen, 1690","sansforgetica, word, simply, non-seen, similar, Sure not seen, 1663","sansforgetica, non-word, continated, seen, continated, Probably seen, 5199","sansforgetica, non-word, shass, seen, shass, Sure seen, 1697","arial, word, front, Sure word, 8950","arial, word, energy, Sure word, 1894","arial, non-word, conferation, Probably non-word, 4221","arial, non-word, beckeys, Sure non-word, 1919","arial, word, develop, Sure word, 1606","arial, word, miles, Sure word, 1582","arial, word, religious, Sure word, 1471","arial, word, command, Sure word, 1545","arial, non-word, increaul, Sure non-word, 1961","arial, non-word, unfortiated, Probably non-word, 2561","arial, non-word, ultomobile, Sure non-word, 2159","arial, word, pieces, Sure word, 1653","arial, non-word, morence, Sure non-word, 1661","arial, word, societies, Sure word, 1885","arial, non-word, minalry, Probably non-word, 2238","arial, non-word, martain, Sure non-word, 3624","arial, non-word, specions, Probably non-word, 2436","arial, non-word, remangth, Sure non-word, 2961","arial, word, count, Sure word, 1761","arial, word, familiar, Sure word, 1326","78","very easy to read","arial, word, remain, non-seen, religious, Sure seen, 5729","arial, word, families, non-seen, familiar, Probably not seen, 9325","arial, word, count, seen, count, Probably not seen, 854","arial, non-word, mastruntion, non-seen, martain, Probably not seen, 1836","arial, non-word, specket, non-seen, specions, Sure not seen, 1765","arial, word, enjoy, non-seen, energy, Sure seen, 3451","arial, word, develop, seen, develop, Sure seen, 1349","arial, non-word, minalry, seen, minalry, Sure seen, 1683","arial, non-word, umbrated, non-seen, ultomobile, Sure not seen, 2747","arial, non-word, remansion, non-seen, remangth, Sure not seen, 1884","arial, word, commercial, non-seen, command, Sure not seen, 1805","arial, word, pieces, seen, pieces, Sure seen, 1526","arial, non-word, morence, seen, morence, Sure seen, 1534","arial, word, miles, seen, miles, Sure seen, 1429","arial, non-word, increaul, seen, increaul, Sure seen, 1427","arial, non-word, unfortiated, seen, unfortiated, Sure seen, 1565","2322182","12-04-2019 03:11"
"yes","Non-designer","1","arial, word, thinking, Sure word, 2558","arial, word, president, Sure word, 2085","arial, non-word, eleatome, Sure non-word, 6734","arial, non-word, neacten, Sure non-word, 2930","arial, non-word, preaped, Sure non-word, 5815","arial, word, greatest, Sure word, 1659","arial, non-word, misappriate, Probably word, 3975","arial, non-word, compritable, Sure non-word, 3538","arial, non-word, sunget, Probably non-word, 2454","arial, word, despite, Sure word, 1799","arial, non-word, attertant, Probably non-word, 6002","arial, word, religious, Sure word, 1876","arial, word, officers, Sure word, 1772","arial, non-word, fraditted, Probably non-word, 5838","arial, word, cannot, Sure word, 1648","arial, word, perfectly, Sure word, 1564","arial, non-word, senal, Sure non-word, 2488","arial, non-word, shannishes, Sure non-word, 1953","arial, word, allow, Sure word, 1554","arial, word, leaves, Sure word, 1502","62","very easy to read","arial, word, official, non-seen, officers, Probably not seen, 7156","arial, word, perfectly, seen, perfectly, Probably seen, 3147","arial, word, leaves, seen, leaves, Sure seen, 2066","arial, non-word, miscuity, non-seen, misappriate, Sure not seen, 2080","arial, non-word, shass, non-seen, shannishes, Sure not seen, 3293","arial, word, green, non-seen, greatest, Sure not seen, 1939","arial, non-word, compution, non-seen, compritable, Sure not seen, 2335","arial, non-word, eleatome, seen, eleatome, Sure seen, 2081","arial, non-word, senal, seen, senal, Sure seen, 1942","arial, non-word, preaped, seen, preaped, Sure seen, 2381","arial, non-word, attrusive, non-seen, attertant, Probably not seen, 2836","arial, word, third, non-seen, thinking, Sure not seen, 2223","arial, non-word, neacten, seen, neacten, Sure seen, 2089","arial, word, religious, seen, religious, Sure seen, 1840","arial, word, details, non-seen, despite, Probably not seen, 2835","arial, word, president, seen, president, Sure seen, 1748","sansforgetica, non-word, undertaned, Sure non-word, 9056","sansforgetica, non-word, repearated, Probably non-word, 7495","sansforgetica, word, business, Sure word, 2123","sansforgetica, non-word, hartilment, Sure non-word, 3732","sansforgetica, word, peace, Sure word, 1635","sansforgetica, word, somewhere, Sure word, 3170","sansforgetica, word, walls, Sure word, 1591","sansforgetica, non-word, conscioning, Sure non-word, 3180","sansforgetica, word, government, Sure word, 1566","sansforgetica, non-word, divitive, Sure non-word, 3738","sansforgetica, non-word, fissely, Probably non-word, 4650","sansforgetica, word, moving, Sure word, 1499","sansforgetica, word, learn, Sure word, 1722","sansforgetica, non-word, fildle, Probably non-word, 4880","sansforgetica, word, confidence, Sure word, 1621","sansforgetica, word, needed, Sure word, 1711","sansforgetica, word, familiar, Sure word, 1571","sansforgetica, non-word, lunds, Probably non-word, 3437","sansforgetica, non-word, adolormated, Sure non-word, 6364","sansforgetica, non-word, revernment, Sure non-word, 3115","64","difficult to read","sansforgetica, non-word, advanth, non-seen, adolormated, Sure not seen, 2773","sansforgetica, word, government, seen, government, Sure seen, 1775","sansforgetica, non-word, fissity, non-seen, fissely, Probably not seen, 3995","sansforgetica, non-word, divitive, seen, divitive, Probably seen, 2462","sansforgetica, non-word, headent, non-seen, hartilment, Sure not seen, 2693","sansforgetica, non-word, lunnest, non-seen, lunds, Probably seen, 3657","sansforgetica, non-word, revernment, seen, revernment, Sure seen, 2334","sansforgetica, non-word, fildle, seen, fildle, Sure seen, 1844","sansforgetica, word, moving, seen, moving, Probably not seen, 2458","sansforgetica, word, confidence, seen, confidence, Probably not seen, 3582","sansforgetica, word, familiar, seen, familiar, Probably seen, 3892","sansforgetica, word, sorry, non-seen, somewhere, Sure not seen, 2310","sansforgetica, word, needs, non-seen, needed, Sure seen, 3424","sansforgetica, word, learning, non-seen, learn, Probably not seen, 2056","sansforgetica, word, people, non-seen, peace, Probably not seen, 1683","sansforgetica, non-word, undertaned, seen, undertaned, Sure seen, 2391","2322136","12-04-2019 03:05"
"yes","Non-designer","1","arial, non-word, demething, Probably non-word, 3979","arial, non-word, meanspheted, Probably non-word, 4043","arial, word, start, Sure word, 2323","arial, non-word, revernment, Probably word, 3685","arial, word, legal, Sure word, 2229","arial, word, means, Sure word, 2583","arial, non-word, emposprism, Probably word, 4515","arial, word, holding, Sure word, 2105","arial, non-word, cerfested, Sure non-word, 2776","arial, word, spite, Sure word, 2191","arial, word, training, Sure word, 1637","arial, word, speed, Sure word, 1783","arial, non-word, gensibility, Probably non-word, 3476","arial, word, western, Sure word, 1846","arial, non-word, respantive, Probably word, 2168","arial, word, danger, Sure word, 1614","arial, non-word, littletely, Sure non-word, 3925","arial, word, nobody, Sure word, 1961","arial, non-word, addicaches, Probably non-word, 5068","arial, non-word, visher, Sure non-word, 1896","50","very easy to read","arial, word, means, seen, means, Sure seen, 2716","arial, non-word, vissily, non-seen, visher, Sure seen, 1982","arial, non-word, cerving, non-seen, cerfested, Sure not seen, 4906","arial, non-word, riddly, non-seen, revernment, Sure not seen, 2466","arial, word, danger, seen, danger, Sure seen, 2111","arial, non-word, emposprism, seen, emposprism, Sure seen, 2433","arial, word, holiday, non-seen, holding, Sure not seen, 2589","arial, word, legal, seen, legal, Sure seen, 2448","arial, non-word, addicaches, seen, addicaches, Sure seen, 5152","arial, word, travel, non-seen, training, Probably not seen, 4541","arial, non-word, littletely, seen, littletely, Sure seen, 2266","arial, non-word, meanspheted, seen, meanspheted, Sure seen, 2390","arial, word, spoke, non-seen, spite, Sure not seen, 2331","arial, non-word, demillining, non-seen, demething, Sure not seen, 2518","arial, word, nodded, non-seen, nobody, Sure not seen, 2400","arial, word, western, seen, western, Sure seen, 1961","sansforgetica, non-word, verved, Probably word, 6915","sansforgetica, non-word, schoon, Probably word, 5061","sansforgetica, non-word, desterly, Probably non-word, 3679","sansforgetica, word, discovered, Sure word, 1931","sansforgetica, word, saying, Sure word, 2425","sansforgetica, word, formed, Sure word, 1896","sansforgetica, word, follow, Sure word, 1327","sansforgetica, non-word, recrophouts, Probably non-word, 4622","sansforgetica, non-word, conscioning, Sure word, 3044","sansforgetica, word, prevent, Sure word, 1471","sansforgetica, word, worst, Sure word, 1323","sansforgetica, word, principle, Sure word, 1443","sansforgetica, non-word, begar, Sure word, 1415","sansforgetica, word, large, Sure word, 1331","sansforgetica, non-word, guatiammer, Sure non-word, 4664","sansforgetica, non-word, overicted, Probably non-word, 2701","sansforgetica, word, could, Sure word, 1937","sansforgetica, non-word, nodief, Sure non-word, 3555","sansforgetica, word, grown, Sure word, 1942","sansforgetica, non-word, gradequate, Probably non-word, 2919","50","easy to read","sansforgetica, non-word, verved, seen, verved, Sure seen, 2213","sansforgetica, non-word, overicted, seen, overicted, Sure seen, 2648","sansforgetica, non-word, nodief, seen, nodief, Sure seen, 2030","sansforgetica, non-word, deterienth, non-seen, desterly, Sure not seen, 5362","sansforgetica, word, worth, non-seen, worst, Sure seen, 2687","sansforgetica, non-word, rectined, non-seen, recrophouts, Sure not seen, 2874","sansforgetica, non-word, grandials, non-seen, gradequate, Sure not seen, 2285","sansforgetica, word, council, non-seen, could, Sure not seen, 1806","sansforgetica, word, formed, seen, formed, Sure seen, 1951","sansforgetica, non-word, beginness, non-seen, begar, Sure not seen, 3295","sansforgetica, word, largely, non-seen, large, Probably not seen, 3130","sansforgetica, word, saying, seen, saying, Probably not seen, 2135","sansforgetica, word, principle, seen, principle, Sure seen, 2343","sansforgetica, non-word, guatiammer, seen, guatiammer, Sure seen, 2684","sansforgetica, word, discovered, seen, discovered, Sure seen, 2117","sansforgetica, word, previous, non-seen, prevent, Probably not seen, 4652","2321454","12-04-2019 00:22"
