"yes","Non-designer","1","arial, non-word, mastruntion, Probably non-word, 4413","arial, non-word, chason, Probably word, 3086","arial, non-word, masuld, Probably word, 6323","arial, non-word, restratians, Probably non-word, 6639","arial, word, nodded, Sure word, 2632","arial, word, service, Sure word, 2350","arial, word, compared, Sure word, 1498","arial, non-word, mixting, Probably word, 2870","arial, word, following, Sure word, 1576","arial, word, badly, Sure word, 1786","arial, word, train, Sure word, 1450","arial, non-word, reasonatic, Sure non-word, 4051","arial, non-word, thips, Sure non-word, 1947","arial, non-word, attermingly, Sure non-word, 1799","arial, word, accident, Sure word, 1792","arial, word, loved, Sure word, 1462","arial, non-word, beight, Probably non-word, 2129","arial, word, hardly, Sure word, 1678","arial, non-word, becieve, Probably non-word, 2092","arial, word, becoming, Sure word, 1588","71","ok","arial, word, forced, non-seen, following, Sure not seen, 6132","arial, word, compared, seen, compared, Probably seen, 3820","arial, word, bedroom, non-seen, becoming, Sure not seen, 2493","arial, non-word, restratians, seen, restratians, Sure seen, 2881","arial, non-word, attertant, non-seen, attermingly, Sure not seen, 2496","arial, non-word, reasonatic, seen, reasonatic, Sure seen, 2403","arial, non-word, mixtured, non-seen, mixting, Probably not seen, 3296","arial, word, nodded, seen, nodded, Sure seen, 1730","arial, non-word, beliany, non-seen, beight, Sure not seen, 1920","arial, word, having, non-seen, hardly, Sure not seen, 2800","arial, word, service, seen, service, Sure seen, 1830","arial, non-word, beckeys, non-seen, becieve, Sure not seen, 1890","arial, word, balance, non-seen, badly, Sure not seen, 3383","arial, word, accident, seen, accident, Sure seen, 1564","arial, non-word, thips, seen, thips, Sure seen, 3033","arial, non-word, chason, seen, chason, Sure seen, 2181","sansforgetica, word, these, Sure word, 4479","sansforgetica, non-word, conferical, Probably non-word, 5129","sansforgetica, word, money, Sure word, 1945","sansforgetica, word, death, Sure word, 1726","sansforgetica, word, simply, Sure word, 1388","sansforgetica, word, department, Sure word, 3453","sansforgetica, word, drive, Sure word, 1728","sansforgetica, non-word, herhaps, Sure non-word, 6425","sansforgetica, non-word, frangee, Probably non-word, 2736","sansforgetica, non-word, invironable, Sure non-word, 5570","sansforgetica, non-word, remernal, Sure non-word, 3250","sansforgetica, non-word, defernable, Probably non-word, 4382","sansforgetica, non-word, couled, Sure non-word, 4968","sansforgetica, non-word, uniffests, Sure non-word, 3269","sansforgetica, word, phone, Sure word, 1570","sansforgetica, word, happy, Sure word, 2831","sansforgetica, non-word, wates, Probably non-word, 4726","sansforgetica, word, change, Sure word, 1573","sansforgetica, non-word, condiers, Probably non-word, 5772","sansforgetica, word, campaign, Sure word, 1275","76","ok","sansforgetica, non-word, frantage, non-seen, frangee, Sure not seen, 3190","sansforgetica, word, thick, non-seen, these, Probably not seen, 5223","sansforgetica, word, driving, non-seen, drive, Sure seen, 1457","sansforgetica, non-word, wates, seen, wates, Sure seen, 2248","sansforgetica, non-word, remernal, seen, remernal, Sure seen, 3146","sansforgetica, word, campaign, seen, campaign, Sure seen, 1386","sansforgetica, non-word, conferical, seen, conferical, Sure seen, 2818","sansforgetica, word, money, seen, money, Sure seen, 1608","sansforgetica, word, change, seen, change, Sure seen, 1838","sansforgetica, word, decade, non-seen, death, Probably not seen, 2743","sansforgetica, non-word, counciation, non-seen, couled, Sure not seen, 3716","sansforgetica, word, simply, seen, simply, Sure seen, 1740","sansforgetica, non-word, conduced, non-seen, condiers, Sure seen, 2223","sansforgetica, non-word, definatute, non-seen, defernable, Sure not seen, 3351","sansforgetica, non-word, invironable, seen, invironable, Sure seen, 2025","sansforgetica, word, happening, non-seen, happy, Probably seen, 2856","2321074","11-04-2019 20:35"
"yes","Non-designer","1","sansforgetica, word, smaller, Sure word, 6643","sansforgetica, word, educational, Sure word, 3687","sansforgetica, word, badly, Sure word, 5198","sansforgetica, word, college, Sure word, 1988","sansforgetica, non-word, mixtured, Sure non-word, 4351","sansforgetica, non-word, conferation, Sure non-word, 2514","sansforgetica, non-word, rutogement, Sure non-word, 2018","sansforgetica, non-word, countions, Sure non-word, 2030","sansforgetica, word, exercise, Sure word, 1881","sansforgetica, word, trust, Sure word, 1456","sansforgetica, non-word, conguage, Probably non-word, 4610","sansforgetica, word, wanted, Sure word, 1776","sansforgetica, non-word, memated, Sure non-word, 3500","sansforgetica, non-word, expeatious, Sure non-word, 4151","sansforgetica, word, labour, Sure word, 1786","sansforgetica, word, listening, Sure word, 1445","sansforgetica, non-word, miregiated, Sure non-word, 3176","sansforgetica, non-word, definatute, Sure non-word, 2167","sansforgetica, word, active, Sure word, 1748","sansforgetica, non-word, morward, Sure non-word, 2426","85","easy to read","sansforgetica, non-word, rutogement, seen, rutogement, Sure seen, 5226","sansforgetica, word, active, seen, active, Sure seen, 3027","sansforgetica, word, truth, non-seen, trust, Sure not seen, 2797","sansforgetica, word, educational, seen, educational, Sure seen, 2144","sansforgetica, word, college, seen, college, Sure seen, 2416","sansforgetica, word, little, non-seen, listening, Sure not seen, 2073","sansforgetica, non-word, memmet, non-seen, memated, Sure not seen, 2537","sansforgetica, non-word, conjunteful, non-seen, conguage, Probably not seen, 4068","sansforgetica, non-word, coupid, non-seen, countions, Sure not seen, 2230","sansforgetica, word, labour, seen, labour, Sure seen, 1639","sansforgetica, non-word, mixtured, seen, mixtured, Sure seen, 1816","sansforgetica, non-word, misappriate, non-seen, miregiated, Sure not seen, 2162","sansforgetica, word, wants, non-seen, wanted, Sure not seen, 1864","sansforgetica, non-word, conferation, seen, conferation, Sure seen, 2030","sansforgetica, non-word, morward, seen, morward, Sure seen, 3032","sansforgetica, word, smell, non-seen, smaller, Sure not seen, 2681","arial, non-word, absturable, Sure non-word, 3617","arial, word, clear, Sure word, 2770","arial, non-word, pronomail, Sure non-word, 1833","arial, non-word, mealth, Sure non-word, 1932","arial, non-word, indernoom, Sure non-word, 2571","arial, word, wearing, Sure word, 1656","arial, word, organized, Sure word, 1321","arial, word, master, Sure word, 1277","arial, word, feeding, Sure word, 2795","arial, non-word, compution, Sure word, 1425","arial, non-word, docionating, Sure non-word, 668","arial, word, putting, Sure word, 1533","arial, word, replied, Sure word, 2798","arial, non-word, dictrised, Sure non-word, 2439","arial, non-word, alont, Sure non-word, 1824","arial, word, required, Sure word, 1603","arial, word, health, Sure word, 1344","arial, word, explained, Sure word, 1350","arial, non-word, convence, Probably non-word, 2311","arial, non-word, cloature, Probably non-word, 2136","81","very easy to read","arial, non-word, meanspheted, non-seen, mealth, Sure not seen, 2598","arial, word, health, seen, health, Probably seen, 2763","arial, word, expression, non-seen, explained, Sure not seen, 2318","arial, non-word, collainess, non-seen, cloature, Sure not seen, 1846","arial, word, reported, non-seen, replied, Sure not seen, 1678","arial, non-word, indernoom, seen, indernoom, Sure seen, 2670","arial, word, match, non-seen, master, Sure not seen, 1782","arial, non-word, docionating, seen, docionating, Sure not seen, 1645","arial, word, feeding, seen, feeding, Sure seen, 1782","arial, non-word, differsive, non-seen, dictrised, Sure not seen, 1739","arial, word, required, seen, required, Probably seen, 3118","arial, non-word, alreado, non-seen, alont, Sure not seen, 1790","arial, non-word, absturable, seen, absturable, Probably not seen, 2528","arial, non-word, pronomail, seen, pronomail, Sure seen, 2302","arial, word, weather, non-seen, wearing, Sure not seen, 1900","arial, word, clear, seen, clear, Sure seen, 1914","2321003","11-04-2019 20:21"
"yes","Non-designer","1","sansforgetica, non-word, varefully, Sure non-word, 3065","sansforgetica, non-word, aponoments, Sure non-word, 3198","sansforgetica, non-word, desposed, Sure non-word, 2934","sansforgetica, word, angry, Sure word, 4342","sansforgetica, non-word, natheracing, Sure non-word, 5388","sansforgetica, non-word, cenism, Sure non-word, 2122","sansforgetica, word, frequently, Sure word, 1998","sansforgetica, non-word, courcish, Sure non-word, 2730","sansforgetica, word, latter, Sure word, 2517","sansforgetica, non-word, promatic, Sure non-word, 1931","sansforgetica, word, national, Sure word, 1966","sansforgetica, non-word, softwall, Probably non-word, 4808","sansforgetica, word, officers, Sure word, 2451","sansforgetica, word, radio, Sure word, 955","sansforgetica, word, occurred, Sure word, 1895","sansforgetica, non-word, attermingly, Sure non-word, 3142","sansforgetica, non-word, mircract, Sure non-word, 2234","sansforgetica, word, failure, Sure word, 1877","sansforgetica, word, appear, Sure word, 1923","sansforgetica, word, actually, Sure word, 1181","50","difficult to read","sansforgetica, non-word, centent, non-seen, cenism, Probably not seen, 15239","sansforgetica, non-word, desterly, non-seen, desposed, Probably not seen, 2889","sansforgetica, word, frequently, seen, frequently, Sure seen, 2824","sansforgetica, word, offer, non-seen, occurred, Sure seen, 1240","sansforgetica, non-word, aponoments, seen, aponoments, Sure seen, 2989","sansforgetica, non-word, promatic, seen, promatic, Sure seen, 1691","sansforgetica, word, natural, non-seen, national, Sure seen, 1164","sansforgetica, word, added, non-seen, actually, Sure not seen, 1920","sansforgetica, word, angry, seen, angry, Sure seen, 1562","sansforgetica, word, failure, seen, failure, Probably not seen, 3881","sansforgetica, non-word, sollaren, non-seen, softwall, Probably not seen, 2695","sansforgetica, non-word, natheracing, seen, natheracing, Sure seen, 2485","sansforgetica, non-word, courcish, seen, courcish, Sure seen, 1405","sansforgetica, word, appear, seen, appear, Sure seen, 1352","sansforgetica, non-word, attertant, non-seen, attermingly, Probably not seen, 4727","sansforgetica, word, raised, non-seen, radio, Sure not seen, 2646","arial, word, myself, Sure word, 4326","arial, word, campaign, Sure word, 6178","arial, non-word, unpligatic, Sure non-word, 1915","arial, non-word, depending, Sure word, 1601","arial, non-word, seanspother, Sure non-word, 1833","arial, word, beyond, Sure word, 1756","arial, non-word, underation, Sure non-word, 1858","arial, non-word, millars, Sure non-word, 5499","arial, non-word, againes, Sure non-word, 1742","arial, word, found, Sure word, 1458","arial, word, presence, Sure word, 1041","arial, word, police, Sure word, 886","arial, non-word, senal, Sure non-word, 2650","arial, non-word, imperstrate, Sure non-word, 2312","arial, non-word, braded, Sure non-word, 1452","arial, word, papers, Sure word, 1474","arial, word, awful, Sure word, 874","arial, word, talked, Sure word, 786","arial, non-word, metween, Sure non-word, 1766","arial, word, individual, Sure word, 1461","50","very easy to read","arial, word, parent, non-seen, papers, Sure not seen, 3781","arial, non-word, millars, seen, millars, Sure seen, 2024","arial, word, beyond, seen, beyond, Sure seen, 2621","arial, non-word, seanspother, seen, seanspother, Sure seen, 2193","arial, non-word, underients, non-seen, underation, Sure seen, 1515","arial, word, talked, seen, talked, Sure seen, 1273","arial, word, freedom, non-seen, found, Probably not seen, 2361","arial, non-word, metween, seen, metween, Sure seen, 1948","arial, non-word, imperstrate, seen, imperstrate, Sure seen, 1400","arial, word, policies, non-seen, police, Probably not seen, 2455","arial, word, presence, seen, presence, Sure seen, 3039","arial, non-word, braven, non-seen, braded, Probably not seen, 2386","arial, word, ability, non-seen, awful, Probably not seen, 2909","arial, non-word, untin, non-seen, unpligatic, Probably not seen, 1683","arial, word, campaign, seen, campaign, Sure seen, 4021","arial, non-word, depernment, non-seen, depending, Sure seen, 2454","2320906","11-04-2019 20:03"
"yes","Non-designer","1","sansforgetica, word, share, Sure word, 6148","sansforgetica, non-word, philogrand, Probably non-word, 5436","sansforgetica, non-word, turpagance, Probably non-word, 7215","sansforgetica, word, planning, Sure word, 1969","sansforgetica, non-word, orgument, Sure non-word, 3560","sansforgetica, word, workers, Sure word, 2901","sansforgetica, non-word, temarrences, Probably non-word, 6733","sansforgetica, word, proper, Sure word, 1700","sansforgetica, word, games, Sure word, 2101","sansforgetica, non-word, socialing, Probably non-word, 4970","sansforgetica, non-word, perind, Sure non-word, 4263","sansforgetica, word, imagine, Sure word, 2997","sansforgetica, word, defence, Sure word, 3643","sansforgetica, non-word, leauty, Probably non-word, 4846","sansforgetica, non-word, commendous, Sure non-word, 3878","sansforgetica, non-word, moverture, Probably non-word, 4073","sansforgetica, non-word, excensium, Probably word, 6428","sansforgetica, word, education, Sure word, 3502","sansforgetica, word, trees, Sure word, 2210","sansforgetica, word, outside, Sure word, 1949","23","ok","sansforgetica, non-word, commendous, seen, commendous, Sure seen, 6054","sansforgetica, word, immediately, non-seen, imagine, Sure not seen, 4271","sansforgetica, word, plans, non-seen, planning, Probably not seen, 2308","sansforgetica, non-word, excent, non-seen, excensium, Sure not seen, 3809","sansforgetica, non-word, turpagance, seen, turpagance, Probably seen, 2984","sansforgetica, non-word, philogrand, seen, philogrand, Sure seen, 2627","sansforgetica, non-word, perman, non-seen, perind, Sure not seen, 2152","sansforgetica, non-word, socialing, seen, socialing, Sure seen, 2304","sansforgetica, non-word, orienuation, non-seen, orgument, Probably not seen, 3249","sansforgetica, word, education, seen, education, Sure seen, 1976","sansforgetica, word, trial, non-seen, trees, Probably not seen, 2878","sansforgetica, word, games, seen, games, Sure seen, 1657","sansforgetica, word, defence, seen, defence, Probably seen, 2602","sansforgetica, word, world, non-seen, workers, Sure not seen, 3827","sansforgetica, word, share, seen, share, Probably seen, 2357","sansforgetica, non-word, tempriation, non-seen, temarrences, Sure seen, 3220","arial, non-word, fesorized, Probably non-word, 4786","arial, word, struck, Sure word, 2069","arial, non-word, valeamer, Sure non-word, 2202","arial, non-word, togethes, Sure non-word, 4613","arial, non-word, enoups, Sure non-word, 2191","arial, word, matter, Sure word, 3589","arial, non-word, natume, Sure non-word, 3138","arial, word, merely, Sure non-word, 3011","arial, word, battle, Sure word, 1399","arial, non-word, discright, Sure non-word, 3847","arial, word, considered, Sure word, 2273","arial, word, involved, Sure word, 1482","arial, word, sector, Sure word, 1561","arial, non-word, natheracing, Sure non-word, 4404","arial, word, beautiful, Sure word, 4486","arial, word, wonderful, Sure word, 1699","arial, non-word, devulaing, Sure non-word, 4902","arial, non-word, discersion, Sure non-word, 3782","arial, word, hoped, Sure word, 1308","arial, non-word, gradboate, Sure non-word, 3913","26","very easy to read","arial, non-word, gradequate, non-seen, gradboate, Probably not seen, 6341","arial, word, hoped, seen, hoped, Sure seen, 1877","arial, word, beautiful, seen, beautiful, Sure seen, 1360","arial, non-word, togetits, non-seen, togethes, Probably not seen, 3682","arial, word, message, non-seen, merely, Probably not seen, 2268","arial, non-word, dictrised, non-seen, devulaing, Probably not seen, 2851","arial, word, wonderful, seen, wonderful, Sure seen, 1584","arial, word, involved, seen, involved, Probably seen, 2370","arial, word, security, non-seen, sector, Probably seen, 2292","arial, non-word, valeamer, seen, valeamer, Probably not seen, 4961","arial, word, maybe, non-seen, matter, Probably not seen, 2202","arial, non-word, natimate, non-seen, natheracing, Probably not seen, 4018","arial, non-word, natume, seen, natume, Sure seen, 3252","arial, non-word, fesorized, seen, fesorized, Sure not seen, 3381","arial, word, beach, non-seen, battle, Probably not seen, 2272","arial, non-word, discersion, seen, discersion, Sure seen, 3437","2320865","11-04-2019 19:54"
"yes","Non-designer","1","arial, non-word, parearch, Sure non-word, 9151","arial, non-word, artividual, Sure non-word, 7158","arial, non-word, lanistic, Probably word, 4866","arial, word, revolution, Sure word, 4660","arial, word, formed, Sure word, 2904","arial, non-word, perferage, Sure non-word, 9332","arial, non-word, restruction, Probably non-word, 6267","arial, non-word, pillern, Probably non-word, 4599","arial, word, pleasure, Sure word, 3775","arial, non-word, cheneved, Sure non-word, 5595","arial, non-word, tommon, Sure non-word, 3268","arial, non-word, lational, Sure non-word, 6805","arial, word, sides, Sure word, 2207","arial, word, match, Sure word, 2157","arial, word, designed, Sure word, 2918","arial, word, looks, Sure word, 2187","arial, non-word, husbage, Probably non-word, 4026","arial, word, active, Sure word, 2089","arial, word, angry, Sure word, 4782","arial, word, concern, Sure word, 3592","89","very easy to read","arial, word, active, seen, active, Sure seen, 9097","arial, word, material, non-seen, match, Sure seen, 4664","arial, non-word, childhons, non-seen, cheneved, Sure not seen, 4039","arial, word, revolution, seen, revolution, Sure seen, 2850","arial, non-word, artividual, seen, artividual, Sure seen, 3187","arial, non-word, restruction, seen, restruction, Sure seen, 2246","arial, non-word, perferage, seen, perferage, Sure seen, 3007","arial, word, concern, seen, concern, Sure seen, 2316","arial, word, sides, seen, sides, Sure seen, 2017","arial, word, desire, non-seen, designed, Probably not seen, 8994","arial, word, plenty, non-seen, pleasure, Sure not seen, 2941","arial, non-word, plactarshed, non-seen, pillern, Sure not seen, 498","arial, non-word, larms, non-seen, lanistic, Sure not seen, 3648","arial, non-word, lational, seen, lational, Sure seen, 2337","arial, word, loved, non-seen, looks, Probably seen, 3042","arial, non-word, hysturably, non-seen, husbage, Sure not seen, 2535","sansforgetica, word, chosen, Sure word, 8789","sansforgetica, word, muscles, Sure word, 3509","sansforgetica, word, accident, Sure word, 4311","sansforgetica, non-word, awallized, Sure non-word, 5436","sansforgetica, non-word, secordlere, Sure non-word, 10431","sansforgetica, word, special, Sure word, 2094","sansforgetica, non-word, uncessified, Sure non-word, 7585","sansforgetica, non-word, nortinge, Sure non-word, 6447","sansforgetica, non-word, genernoon, Sure non-word, 7851","sansforgetica, word, bright, Sure word, 2040","sansforgetica, word, fishing, Sure word, 2918","sansforgetica, non-word, londow, Probably non-word, 7401","sansforgetica, non-word, acadence, Sure non-word, 5061","sansforgetica, word, decade, Sure word, 2186","sansforgetica, word, because, Sure word, 2712","sansforgetica, word, before, Sure word, 2173","sansforgetica, non-word, incogering, Probably non-word, 4549","sansforgetica, word, social, Sure word, 2169","sansforgetica, non-word, resperation, Sure non-word, 17786","sansforgetica, non-word, countions, Sure non-word, 6758","79","easy to read","sansforgetica, non-word, coupid, non-seen, countions, Sure not seen, 10548","sansforgetica, word, began, non-seen, before, Probably not seen, 6008","sansforgetica, non-word, incormately, non-seen, incogering, Sure not seen, 4873","sansforgetica, non-word, noter, non-seen, nortinge, Sure not seen, 2840","sansforgetica, word, because, seen, because, Sure seen, 2348","sansforgetica, non-word, resperation, seen, resperation, Sure seen, 2790","sansforgetica, word, muscles, seen, muscles, Sure seen, 2682","sansforgetica, word, bright, seen, bright, Sure seen, 2776","sansforgetica, word, species, non-seen, special, Sure not seen, 2821","sansforgetica, non-word, uncessified, seen, uncessified, Sure seen, 2876","sansforgetica, word, decade, seen, decade, Probably seen, 3961","sansforgetica, non-word, lonnot, non-seen, londow, Probably not seen, 4423","sansforgetica, word, according, non-seen, accident, Probably not seen, 4976","sansforgetica, word, fixed, non-seen, fishing, Probably not seen, 3410","sansforgetica, non-word, awallized, seen, awallized, Sure seen, 3342","sansforgetica, non-word, acadence, seen, acadence, Sure seen, 5723","2320861","11-04-2019 19:53"
"yes","Non-designer","1","sansforgetica, non-word, meate, Sure non-word, 3604","sansforgetica, word, schools, Sure word, 2289","sansforgetica, word, already, Sure word, 1674","sansforgetica, non-word, eleculants, Sure non-word, 2549","sansforgetica, non-word, objectial, Sure non-word, 2090","sansforgetica, word, touch, Sure word, 1577","sansforgetica, word, entirely, Sure word, 1595","sansforgetica, non-word, wathed, Sure non-word, 2605","sansforgetica, non-word, penerer, Sure non-word, 1837","sansforgetica, word, scale, Sure word, 1513","sansforgetica, word, economic, Sure word, 1552","sansforgetica, word, agreement, Sure word, 1590","sansforgetica, word, terrible, Sure word, 1537","sansforgetica, non-word, welicase, Sure non-word, 1918","sansforgetica, non-word, clesh, Sure non-word, 1582","sansforgetica, non-word, millars, Sure non-word, 1507","sansforgetica, non-word, higether, Sure non-word, 1711","sansforgetica, word, cultural, Sure word, 1492","sansforgetica, word, wearing, Sure word, 1427","sansforgetica, non-word, countions, Sure non-word, 1525","50","ok","sansforgetica, non-word, elemselles, non-seen, eleculants, Sure not seen, 4429","sansforgetica, word, toward, non-seen, touch, Sure not seen, 2531","sansforgetica, non-word, clesh, seen, clesh, Sure seen, 2404","sansforgetica, non-word, meate, seen, meate, Sure seen, 1562","sansforgetica, non-word, wathed, seen, wathed, Sure seen, 1662","sansforgetica, word, scientific, non-seen, schools, Sure not seen, 2340","sansforgetica, word, terrible, seen, terrible, Sure seen, 1795","sansforgetica, word, curious, non-seen, cultural, Sure not seen, 1674","sansforgetica, word, already, seen, already, Sure seen, 1540","sansforgetica, non-word, penerer, seen, penerer, Sure seen, 1790","sansforgetica, word, scene, non-seen, scale, Sure not seen, 1917","sansforgetica, non-word, himsent, non-seen, higether, Sure not seen, 2241","sansforgetica, non-word, coupid, non-seen, countions, Sure not seen, 1535","sansforgetica, non-word, wesisty, non-seen, welicase, Sure not seen, 1350","sansforgetica, word, economic, seen, economic, Sure seen, 1759","sansforgetica, word, entirely, seen, entirely, Sure seen, 1370","arial, word, second, Sure word, 3717","arial, non-word, complefient, Sure non-word, 1822","arial, word, watching, Sure word, 1618","arial, word, crowd, Sure word, 1425","arial, word, stories, Sure word, 1347","arial, non-word, vegimasion, Sure non-word, 1499","arial, word, intended, Sure word, 1336","arial, non-word, separtly, Sure non-word, 1528","arial, non-word, natimate, Sure non-word, 1468","arial, non-word, pariods, Sure non-word, 1424","arial, word, established, Sure word, 1294","arial, non-word, expections, Sure word, 1314","arial, word, independent, Sure word, 1546","arial, word, defence, Sure word, 1464","arial, non-word, doweract, Sure non-word, 1423","arial, word, financial, Sure word, 1527","arial, non-word, pritain, Sure non-word, 1363","arial, non-word, minefic, Sure non-word, 1387","arial, non-word, studymer, Sure non-word, 1305","arial, word, faces, Sure word, 1463","50","very easy to read","arial, non-word, natimerable, non-seen, natimate, Sure not seen, 1811","arial, word, stories, seen, stories, Sure seen, 1454","arial, non-word, doweract, seen, doweract, Sure seen, 2413","arial, non-word, pritialing, non-seen, pritain, Sure not seen, 1414","arial, word, water, non-seen, watching, Sure not seen, 2814","arial, word, independent, seen, independent, Sure seen, 1892","arial, non-word, expectively, non-seen, expections, Sure seen, 2283","arial, non-word, complefient, seen, complefient, Sure seen, 1620","arial, word, degree, non-seen, defence, Sure not seen, 1399","arial, word, intended, seen, intended, Sure seen, 2940","arial, word, evening, non-seen, established, Sure not seen, 1582","arial, word, second, seen, second, Sure seen, 1423","arial, non-word, minefic, seen, minefic, Sure seen, 1589","arial, word, cross, non-seen, crowd, Sure seen, 1538","arial, non-word, sepernment, non-seen, separtly, Sure not seen, 1419","arial, non-word, studymer, seen, studymer, Sure seen, 1485","2320855","11-04-2019 19:51"
